Name	ManaCost	SuperType	Types	SubTypes	Text	Power	Toughness
Shimmering Glasskite	{3}{U}		Creature	Spirit	Flying|Whenever Shimmering Glasskite becomes the target of a spell or ability for the first time in a turn, counter that spell or ability.	2	3
Shining Shoal	{X}{W}{W}		Instant	Arcane	You may exile a white card with converted mana cost X from your hand rather than pay Shining Shoal's mana cost.|The next X damage that a source of your choice would deal to you and/or creatures you control this turn is dealt to target creature or player instead.		
Shinka Gatekeeper	{2}{R}		Creature	Ogre,Warrior	Whenever Shinka Gatekeeper is dealt damage, it deals that much damage to you.	3	2
Shirei, Shizo's Caretaker	{4}{B}	Legendary	Creature	Spirit	Whenever a creature with power 1 or less is put into your graveyard from the battlefield, you may return that card to the battlefield under your control at the beginning of the next end step if Shirei, Shizo's Caretaker is still on the battlefield.	2	2
Shizuko, Caller of Autumn	{1}{G}{G}	Legendary	Creature	Snake,Shaman	At the beginning of each player's upkeep, that player adds {G}{G}{G} to his or her mana pool. Until end of turn, this mana doesn't empty from that player's mana pool as steps and phases end.	2	3
Shuko	{1}		Artifact	Equipment	Equipped creature gets +1/+0.|Equip {0} ({0}: Attach to target creature you control. Equip only as a sorcery.)		
Shuriken	{1}		Artifact	Equipment	Equipped creature has '{T}, Unattach Shuriken: Shuriken deals 2 damage to target creature. That creature's controller gains control of Shuriken unless it was unattached from a Ninja.'|Equip {2} ({2}: Attach to target creature you control. Equip only as a sorcery.)		
Sickening Shoal	{X}{B}{B}		Instant	Arcane	You may exile a black card with converted mana cost X from your hand rather than pay Sickening Shoal's mana cost.|Target creature gets -X/-X until end of turn.		
Silverstorm Samurai	{4}{W}{W}		Creature	Fox,Samurai	Flash|Bushido 1 (When this blocks or becomes blocked, it gets +1/+1 until end of turn.)	3	3
Skullmane Baku	{3}{B}{B}		Creature	Spirit	Whenever you cast a Spirit or Arcane spell, you may put a ki counter on Skullmane Baku.|{1}, {T}, Remove X ki counters from Skullmane Baku: Target creature gets -X/-X until end of turn.	2	1
Skullsnatcher	{1}{B}		Creature	Rat,Ninja	Ninjutsu {B} ({B}, Return an unblocked attacker you control to hand: Put this card onto the battlefield from your hand tapped and attacking.)|Whenever Skullsnatcher deals combat damage to a player, exile up to two target cards from that player's graveyard.	2	1
Slumbering Tora	{3}		Artifact		{2}, Discard a Spirit or Arcane card: Slumbering Tora becomes an X/X Cat artifact creature until end of turn, where X is the discarded card's converted mana cost.		
Soratami Mindsweeper	{3}{U}		Creature	Moonfolk,Wizard	Flying|{2}, Return a land you control to its owner's hand: Target player puts the top two cards of his or her library into his or her graveyard.	1	4
Sosuke's Summons	{2}{G}		Sorcery		Put two 1/1 green Snake creature tokens onto the battlefield.|Whenever a nontoken Snake enters the battlefield under your control, you may return Sosuke's Summons from your graveyard to your hand.		
Sowing Salt	{2}{R}{R}		Sorcery		Exile target nonbasic land. Search its controller's graveyard, hand, and library for all cards with the same name as that land and exile them. Then that player shuffles his or her library.		
Splinter	{2}{G}{G}		Sorcery		Exile target artifact. Search its controller's graveyard, hand, and library for all cards with the same name as that artifact and exile them. Then that player shuffles his or her library.		
Split-Tail Miko	{1}{W}		Creature	Fox,Cleric	{W}, {T}: Prevent the next 2 damage that would be dealt to target creature or player this turn.	1	1
Stir the Grave	{X}{B}		Sorcery		Return target creature card with converted mana cost X or less from your graveyard to the battlefield.		
Stream of Consciousness	{1}{U}		Instant	Arcane	Target player shuffles up to four target cards from his or her graveyard into his or her library.		
Sway of the Stars	{8}{U}{U}		Sorcery		Each player shuffles his or her hand, graveyard, and permanents he or she owns into his or her library, then draws seven cards. Each player's life total becomes 7.		
Takeno's Cavalry	{3}{W}		Creature	Human,Samurai,Archer	Bushido 1 (When this blocks or becomes blocked, it gets +1/+1 until end of turn.)|{T}: Takeno's Cavalry deals 1 damage to target attacking or blocking Spirit.	1	1
Takenuma Bleeder	{2}{B}		Creature	Ogre,Shaman	Whenever Takenuma Bleeder attacks or blocks, you lose 1 life if you don't control a Demon.	3	3
Tallowisp	{1}{W}		Creature	Spirit	Whenever you cast a Spirit or Arcane spell, you may search your library for an Aura card with enchant creature, reveal it, and put it into your hand. If you do, shuffle your library.	1	3
Teardrop Kami	{U}		Creature	Spirit	Sacrifice Teardrop Kami: You may tap or untap target creature.	1	1
Tendo Ice Bridge			Land		Tendo Ice Bridge enters the battlefield with a charge counter on it.|{T}: Add {1} to your mana pool.|{T}, Remove a charge counter from Tendo Ice Bridge: Add one mana of any color to your mana pool.		
Terashi's Grasp	{2}{W}		Sorcery	Arcane	Destroy target artifact or enchantment. You gain life equal to its converted mana cost.		
Terashi's Verdict	{1}{W}		Instant	Arcane	Destroy target attacking creature with power 3 or less.		
That Which Was Taken	{5}	Legendary	Artifact		{4}, {T}: Put a divinity counter on target permanent other than That Which Was Taken.|Each permanent with a divinity counter on it has indestructible.		
Threads of Disloyalty	{1}{U}{U}		Enchantment	Aura	Enchant creature with converted mana cost 2 or less|You control enchanted creature.		
Three Tragedies	{3}{B}{B}		Sorcery	Arcane	Target player discards three cards.		
Throat Slitter	{4}{B}		Creature	Rat,Ninja	Ninjutsu {2}{B} ({2}{B}, Return an unblocked attacker you control to hand: Put this card onto the battlefield from your hand tapped and attacking.)|Whenever Throat Slitter deals combat damage to a player, destroy target nonblack creature that player controls.	2	2
Toils of Night and Day	{2}{U}		Instant	Arcane	You may tap or untap target permanent, then you may tap or untap another target permanent.		
Tomorrow, Azami's Familiar	{5}{U}	Legendary	Creature	Spirit	If you would draw a card, look at the top three cards of your library instead. Put one of those cards into your hand and the rest on the bottom of your library in any order.	1	5
Torrent of Stone	{3}{R}		Instant	Arcane	Torrent of Stone deals 4 damage to target creature.|Splice onto Arcane-Sacrifice two Mountains. (As you cast an Arcane spell, you may reveal this card from your hand and pay its splice cost. If you do, add this card's effects to that spell.)		
Toshiro Umezawa	{1}{B}{B}	Legendary	Creature	Human,Samurai	Bushido 1 (When this blocks or becomes blocked, it gets +1/+1 until end of turn.)|Whenever a creature an opponent controls dies, you may cast target instant card from your graveyard. If that card would be put into a graveyard this turn, exile it instead.	2	2
Traproot Kami	{G}		Creature	Spirit	Defender; reach (This creature can block creatures with flying.)|Traproot Kami's toughness is equal to the number of Forests on the battlefield.	0	*
Twist Allegiance	{6}{R}		Sorcery		You and target opponent each gain control of all creatures the other controls until end of turn. Untap those creatures. Those creatures gain haste until end of turn.		
Umezawa's Jitte	{2}	Legendary	Artifact	Equipment	Whenever equipped creature deals combat damage, put two charge counters on Umezawa's Jitte.|Remove a charge counter from Umezawa's Jitte: Choose one - Equipped creature gets +2/+2 until end of turn; or target creature gets -1/-1 until end of turn; or you gain 2 life.|Equip {2}		
Unchecked Growth	{2}{G}		Instant	Arcane	Target creature gets +4/+4 until end of turn. If it's a Spirit, it gains trample until end of turn.		
Uproot	{3}{G}		Sorcery	Arcane	Put target land on top of its owner's library.		
Veil of Secrecy	{1}{U}		Instant	Arcane	Target creature gains shroud until end of turn and can't be blocked this turn.|Splice onto Arcane-Return a blue creature you control to its owner's hand. (As you cast an Arcane spell, you may reveal this card from your hand and pay its splice cost. If you do, add this card's effects to that spell.)		
Vital Surge	{1}{G}		Instant	Arcane	You gain 3 life.|Splice onto Arcane {1}{G} (As you cast an Arcane spell, you may reveal this card from your hand and pay its splice cost. If you do, add this card's effects to that spell.)		
Walker of Secret Ways	{2}{U}		Creature	Human,Ninja	Ninjutsu {1}{U} ({1}{U}, Return an unblocked attacker you control to hand: Put this card onto the battlefield from your hand tapped and attacking.)|Whenever Walker of Secret Ways deals combat damage to a player, look at that player's hand.|{1}{U}: Return target Ninja you control to its owner's hand. Activate this ability only during your turn.	1	2
Ward of Piety	{1}{W}		Enchantment	Aura	Enchant creature|{1}{W}: The next 1 damage that would be dealt to enchanted creature this turn is dealt to target creature or player instead.		
Waxmane Baku	{2}{W}		Creature	Spirit	Whenever you cast a Spirit or Arcane spell, you may put a ki counter on Waxmane Baku.|{1}, Remove X ki counters from Waxmane Baku: Tap X target creatures.	2	2
Yomiji, Who Bars the Way	{5}{W}{W}	Legendary	Creature	Spirit	Whenever a legendary permanent other than Yomiji, Who Bars the Way is put into a graveyard from the battlefield, return that card to its owner's hand.	4	4
Yukora, the Prisoner	{2}{B}{B}	Legendary	Creature	Demon,Spirit	When Yukora, the Prisoner leaves the battlefield, sacrifice all non-Ogre creatures you control.	5	5
