Name	ManaCost	SuperType	Types	SubTypes	Text	Power	Toughness
Frenzied Fugue	{3}{R}	None	Enchantment	Aura	Enchant permanent|When Frenzied Fugue enters the battlefield or at the beginning of your upkeep, gain control of enchanted permanent until end of turn. Untap that permanent. It gains haste until end of turn.		
Frontier Bivouac		None	Land	None	Frontier Bivouac enters the battlefield tapped.|{T}: Add {G}, {U}, or {R} to your mana pool.		
Gamekeeper	{3}{G}	None	Creature	Elf	When Gamekeeper dies, you may exile it. If you do, reveal cards from the top of your library until you reveal a creature card. Put that card onto the battlefield and put all other cards revealed this way into your graveyard.	2	2
Ghastly Conscription	{5}{B}{B}	None	Sorcery	None	Exile all creature cards from target player's graveyard in a face-down pile, shuffle that pile, then manifest those cards. (To manifest a card, put it onto the battlefield face down as a 2/2 creature. Turn it face up any time for its mana cost if it's a creature card.)		
Ghave, Guru of Spores	{2}{B}{G}{W}	Legendary	Creature	Fungus,Shaman	Ghave, Guru of Spores enters the battlefield with five +1/+1 counters on it.|{1}, Remove a +1/+1 counter from a creature you control: Create a 1/1 green Saproling creature token.|{1}, Sacrifice a creature: Put a +1/+1 counter on target creature.	0	0
Ghostly Prison	{2}{W}	None	Enchantment	None	Creatures can't attack you unless their controller pays {2} for each creature he or she controls that's attacking you.		
Glint-Eye Nephilim	{U}{B}{R}{G}	None	Creature	Nephilim	Whenever Glint-Eye Nephilim deals combat damage to a player, draw that many cards.|{1}, Discard a card: Glint-Eye Nephilim gets +1/+1 until end of turn.	2	2
Goblin Spymaster	{2}{R}	None	Creature	Goblin,Rogue	First strike|At the beginning of each opponent's end step, that player creates a 1/1 red Goblin creature token with 'Creatures you control attack each combat if able.'	2	1
Godo, Bandit Warlord	{5}{R}	Legendary	Creature	Human,Barbarian	When Godo, Bandit Warlord enters the battlefield, you may search your library for an Equipment card and put it onto the battlefield. If you do, shuffle your library.|Whenever Godo attacks for the first time each turn, untap it and all Samurai you control. After this phase, there is an additional combat phase.	3	3
Golgari Rot Farm		None	Land	None	Golgari Rot Farm enters the battlefield tapped.|When Golgari Rot Farm enters the battlefield, return a land you control to its owner's hand.|{T}: Add {B}{G} to your mana pool.		
Golgari Signet	{2}	None	Artifact	None	{1}, {T}: Add {B}{G} to your mana pool.		
Grab the Reins	{3}{R}	None	Instant	None	Choose one -|• Until end of turn, you gain control of target creature and it gains haste.|• Sacrifice a creature. Grab the Reins deals damage equal to that creature's power to target creature or player.|Entwine {2}{R} (Choose both if you pay the entwine cost.)		
Grand Coliseum		None	Land	None	Grand Coliseum enters the battlefield tapped.|{T}: Add  to your mana pool.|{T}: Add one mana of any color to your mana pool. Grand Coliseum deals 1 damage to you.		
Grave Upheaval	{4}{B}{R}	None	Sorcery	None	Put target creature card from a graveyard onto the battlefield under your control. It gains haste.|Basic landcycling {2} ({2}, Discard this card: Search your library for a basic land card, reveal it, and put it into your hand. Then shuffle your library.)		
Grip of Phyresis	{2}{U}	None	Instant	None	Gain control of target Equipment, then create a 0/0 black Germ creature token and attach that Equipment to it.		
Gruul Signet	{2}	None	Artifact	None	{1}, {T}: Add {R}{G} to your mana pool.		
Gruul Turf		None	Land	None	Gruul Turf enters the battlefield tapped.|When Gruul Turf enters the battlefield, return a land you control to its owner's hand.|{T}: Add {R}{G} to your mana pool.		
Guiltfeeder	{3}{B}{B}	None	Creature	Horror	Fear (This creature can't be blocked except by artifact creatures and/or black creatures.)|Whenever Guiltfeeder attacks and isn't blocked, defending player loses 1 life for each card in his or her graveyard.	0	4
Gwafa Hazid, Profiteer	{1}{W}{U}	Legendary	Creature	Human,Rogue	{W}{U}, {T}: Put a bribery counter on target creature you don't control. Its controller draws a card.|Creatures with bribery counters on them can't attack or block.	2	2
Hanna, Ship's Navigator	{1}{W}{U}	Legendary	Creature	Human,Artificer	{1}{W}{U}, {T}: Return target artifact or enchantment card from your graveyard to your hand.	1	2
Hardened Scales	{G}	None	Enchantment	None	If one or more +1/+1 counters would be placed on a creature you control, that many plus one +1/+1 counters are placed on it instead.		
Hellkite Igniter	{5}{R}{R}	None	Creature	Dragon	Flying, haste|{1}{R}: Hellkite Igniter gets +X/+0 until end of turn, where X is the number of artifacts you control.	5	5
Hellkite Tyrant	{4}{R}{R}	None	Creature	Dragon	Flying, trample|Whenever Hellkite Tyrant deals combat damage to a player, gain control of all artifacts that player controls.|At the beginning of your upkeep, if you control twenty or more artifacts, you win the game.	6	5
Homeward Path		None	Land	None	{T}: Add  to your mana pool.|{T}: Each player gains control of all creatures he or she owns.		
Hoofprints of the Stag	{1}{W}	None	Tribal,Enchantment	Elemental	Whenever you draw a card, you may put a hoofprint counter on Hoofprints of the Stag.|{2}{W}, Remove four hoofprint counters from Hoofprints of the Stag: Create a 4/4 white Elemental creature token with flying. Activate this ability only during your turn.		
Horizon Chimera	{2}{G}{U}	None	Creature	Chimera	Flash|Flying, trample|Whenever you draw a card, you gain 1 life.	3	2
Howling Mine	{2}	None	Artifact	None	At the beginning of each player's draw step, if Howling Mine is untapped, that player draws an additional card.		
Humble Defector	{1}{R}	None	Creature	Human,Rogue	{T}: Draw two cards. Target opponent gains control of Humble Defector. Activate this ability only during your turn.	2	1
Hushwing Gryff	{2}{W}	None	Creature	Hippogriff	Flash|Flying|Creatures entering the battlefield don't cause abilities to trigger.	2	1
Ichor Wellspring	{2}	None	Artifact	None	When Ichor Wellspring enters the battlefield or is put into a graveyard from the battlefield, draw a card.		
Ikra Shidiqi, the Usurper	{3}{B}{G}	Legendary	Creature	Naga,Wizard	Menace|Whenever a creature you control deals combat damage to a player, you gain life equal to that creature's toughness.|Partner (You can have two commanders if both have partner.)	3	7
In Garruk's Wake	{7}{B}{B}	None	Sorcery	None	Destroy all creatures you don't control and all planeswalkers you don't control.		
Inspiring Call	{2}{G}	None	Instant	None	Draw a card for each creature you control with a +1/+1 counter on it. Those creatures gain indestructible until end of turn.		
Iroas, God of Victory	{2}{R}{W}	Legendary	Enchantment,Creature	God	Indestructible|As long as your devotion to red and white is less than seven, Iroas isn't a creature.|Creatures you control have menace.|Prevent all damage that would be dealt to attacking creatures you control.	7	4
Ishai, Ojutai Dragonspeaker	{2}{W}{U}	Legendary	Creature	Bird,Monk	Flying|Whenever an opponent casts a spell, put a +1/+1 counter on Ishai, Ojutai Dragonspeaker.|Partner (You can have two commanders if both have partner.)	1	1
Island		Basic	Land	Island	U		
Izzet Boilerworks		None	Land	None	Izzet Boilerworks enters the battlefield tapped.|When Izzet Boilerworks enters the battlefield, return a land you control to its owner's hand.|{T}: Add {U}{R} to your mana pool.		
Jor Kadeen, the Prevailer	{3}{R}{W}	Legendary	Creature	Human,Warrior	First strike|Metalcraft - Creatures you control get +3/+0 as long as you control three or more artifacts.	5	4
Jungle Hollow		None	Land	None	Jungle Hollow enters the battlefield tapped.|When Jungle Hollow enters the battlefield, you gain 1 life.|{T}: Add {B} or {G} to your mana pool.		
Jungle Shrine		None	Land	None	Jungle Shrine enters the battlefield tapped.|{T}: Add {R}, {G}, or {W} to your mana pool.		
Juniper Order Ranger	{3}{G}{W}	None	Creature	Human,Knight	Whenever another creature enters the battlefield under your control, put a +1/+1 counter on that creature and a +1/+1 counter on Juniper Order Ranger.	2	4
Kalonian Hydra	{3}{G}{G}	None	Creature	Hydra	Trample|Kalonian Hydra enters the battlefield with four +1/+1 counters on it.|Whenever Kalonian Hydra attacks, double the number of +1/+1 counters on each creature you control.	0	0
Karplusan Forest		None	Land	None	{T}: Add  to your mana pool.|{T}: Add {R} or {G} to your mana pool. Karplusan Forest deals 1 damage to you.		
Kazuul, Tyrant of the Cliffs	{3}{R}{R}	Legendary	Creature	Ogre,Warrior	Whenever a creature an opponent controls attacks, if you're the defending player, create a 3/3 red Ogre creature token unless that creature's controller pays {3}.	5	4
Keening Stone	{6}	None	Artifact	None	{5}, {T}: Target player puts the top X cards of his or her library into his or her graveyard, where X is the number of cards in that player's graveyard.		
Kodama's Reach	{2}{G}	None	Sorcery	Arcane	Search your library for up to two basic land cards, reveal those cards, and put one onto the battlefield tapped and the other into your hand. Then shuffle your library.		
Korozda Guildmage	{B}{G}	None	Creature	Elf,Shaman	{1}{B}{G}: Target creature gets +1/+1 and gains intimidate until end of turn. (It can't be blocked except by artifact creatures and/or creatures that share a color with it.)|{2}{B}{G}, Sacrifice a nontoken creature: Create X 1/1 green Saproling creature tokens, where X is the sacrificed creature's toughness.	2	2
Kraum, Ludevic's Opus	{3}{U}{R}	Legendary	Creature	Zombie,Horror	Flying, haste|Whenever an opponent casts his or her second spell each turn, draw a card.|Partner (You can have two commanders if both have partner.)	4	4
Krosan Verge		None	Land	None	Krosan Verge enters the battlefield tapped.|{T}: Add  to your mana pool.|{2}, {T}, Sacrifice Krosan Verge: Search your library for a Forest card and a Plains card and put them onto the battlefield tapped. Then shuffle your library.		
Kydele, Chosen of Kruphix	{2}{G}{U}	Legendary	Creature	Human,Wizard	{T}: Add  to your mana pool for each card you've drawn this turn.|Partner (You can have two commanders if both have partner.)	2	3
Kynaios and Tiro of Meletis	{R}{G}{W}{U}	Legendary	Creature	Human,Soldier	At the beginning of your end step, draw a card. Each player may put a land card from his or her hand onto the battlefield, then each opponent who didn't draws a card.	2	8
Languish	{2}{B}{B}	None	Sorcery	None	All creatures get -4/-4 until end of turn.		
Lavalanche	{X}{B}{R}{G}	None	Sorcery	None	Lavalanche deals X damage to target player and each creature he or she controls.		
Lightning Greaves	{2}	None	Artifact	Equipment	Equipped creature has haste and shroud. (It can't be the target of spells or abilities.)|Equip {0}		
Loxodon Warhammer	{3}	None	Artifact	Equipment	Equipped creature gets +3/+0 and has trample and lifelink.|Equip {3}		
Ludevic, Necro-Alchemist	{1}{U}{R}	Legendary	Creature	Human,Wizard	At the beginning of each player's end step, that player may draw a card if a player other than you lost life this turn.|Partner (You can have two commanders if both have partner.)	1	4
Lurking Predators	{4}{G}{G}	None	Enchantment	None	Whenever an opponent casts a spell, reveal the top card of your library. If it's a creature card, put it onto the battlefield. Otherwise, you may put that card on the bottom of your library.		
Magus of the Will	{2}{B}	None	Creature	Human,Wizard	{2}{B}, {T}, Exile Magus of the Will: Until end of turn, you may play cards from your graveyard. If a card would be put into your graveyard from anywhere this turn, exile that card instead.	3	3
Managorger Hydra	{2}{G}	None	Creature	Hydra	Trample|Whenever a player casts a spell, put a +1/+1 counter on Managorger Hydra.	1	1
Manifold Insights	{2}{U}	None	Sorcery	None	Reveal the top ten cards of your library. Starting with the next opponent in turn order, each opponent chooses a different nonland card from among them. Put the chosen cards into your hand and the rest on the bottom of your library in a random order.		
Master Biomancer	{2}{G}{U}	None	Creature	Elf,Wizard	Each other creature you control enters the battlefield with a number of additional +1/+1 counters on it equal to Master Biomancer's power and as a Mutant in addition to its other types.	2	4
Master of Etherium	{2}{U}	None	Artifact,Creature	Vedalken,Wizard	Master of Etherium's power and toughness are each equal to the number of artifacts you control.|Other artifact creatures you control get +1/+1.	*	*
Mentor of the Meek	{2}{W}	None	Creature	Human,Soldier	Whenever another creature with power 2 or less enters the battlefield under your control, you may pay {1}. If you do, draw a card.	2	2
Merciless Eviction	{4}{W}{B}	None	Sorcery	None	Choose one -|• Exile all artifacts.|• Exile all creatures.|• Exile all enchantments.|• Exile all planeswalkers.		
Migratory Route	{3}{W}{U}	None	Sorcery	None	Create four 1/1 white Bird creature tokens with flying.|Basic landcycling {2} ({2}, Discard this card: Search your library for a basic land card, reveal it, and put it into your hand. Then shuffle your library.)		
Minds Aglow	{U}	None	Sorcery	None	Join forces - Starting with you, each player may pay any amount of mana. Each player draws X cards, where X is the total amount of mana paid this way.		
Mirror Entity	{2}{W}	None	Creature	Shapeshifter	Changeling (This card is every creature type.)|{X}: Until end of turn, creatures you control have base power and toughness X/X and gain all creature types.	1	1
Mirrorweave	{2}{W/U}{W/U}	None	Instant	None	Each other creature becomes a copy of target nonlegendary creature until end of turn.		
Mortify	{1}{W}{B}	None	Instant	None	Destroy target creature or enchantment.		
Mosswort Bridge		None	Land	None	Hideaway (This land enters the battlefield tapped. When it does, look at the top four cards of your library, exile one face down, then put the rest on the bottom of your library.)|{T}: Add {G} to your mana pool.|{G}, {T}: You may play the exiled card without paying its mana cost if creatures you control have total power 10 or greater.		
Mountain		Basic	Land	Mountain	R		
Murmuring Bosk		None	Land	Forest	({T}: Add {G} to your mana pool.)|As Murmuring Bosk enters the battlefield, you may reveal a Treefolk card from your hand. If you don't, Murmuring Bosk enters the battlefield tapped.|{T}: Add {W} or {B} to your mana pool. Murmuring Bosk deals 1 damage to you.		
Mycoloth	{3}{G}{G}	None	Creature	Fungus	Devour 2 (As this enters the battlefield, you may sacrifice any number of creatures. This creature enters the battlefield with twice that many +1/+1 counters on it.)|At the beginning of your upkeep, create a 1/1 green Saproling creature token for each +1/+1 counter on Mycoloth.	4	4
Mycosynth Wellspring	{2}	None	Artifact	None	When Mycosynth Wellspring enters the battlefield or is put into a graveyard from the battlefield, you may search your library for a basic land card, reveal it, put it into your hand, then shuffle your library.		
Myr Battlesphere	{7}	None	Artifact,Creature	Myr,Construct	When Myr Battlesphere enters the battlefield, create four 1/1 colorless Myr artifact creature tokens.|Whenever Myr Battlesphere attacks, you may tap X untapped Myr you control. If you do, Myr Battlesphere gets +X/+0 until end of turn and deals X damage to defending player.	4	7
Myr Retriever	{2}	None	Artifact,Creature	Myr	When Myr Retriever dies, return another target artifact card from your graveyard to your hand.	1	1
Myriad Landscape		None	Land	None	Myriad Landscape enters the battlefield tapped.|{T}: Add  to your mana pool.|{2}, {T}, Sacrifice Myriad Landscape: Search your library for up to two basic land cards that share a land type, put them onto the battlefield tapped, then shuffle your library.		
Mystic Monastery		None	Land	None	Mystic Monastery enters the battlefield tapped.|{T}: Add {U}, {R}, or {W} to your mana pool.		
Nath of the Gilt-Leaf	{3}{B}{G}	Legendary	Creature	Elf,Warrior	At the beginning of your upkeep, you may have target opponent discard a card at random.|Whenever an opponent discards a card, you may create a 1/1 green Elf Warrior creature token.	4	4
Naya Charm	{R}{G}{W}	None	Instant	None	Choose one -|• Naya Charm deals 3 damage to target creature.|• Return target card from a graveyard to its owner's hand.|• Tap all creatures target player controls.		
Necrogenesis	{B}{G}	None	Enchantment	None	{2}: Exile target creature card from a graveyard. Create a 1/1 green Saproling creature token.		
Necroplasm	{1}{B}{B}	None	Creature	Ooze	At the beginning of your upkeep, put a +1/+1 counter on Necroplasm.|At the beginning of your end step, destroy each creature with converted mana cost equal to the number of +1/+1 counters on Necroplasm.|Dredge 2 (If you would draw a card, instead you may put exactly two cards from the top of your library into your graveyard. If you do, return this card from your graveyard to your hand. Otherwise, draw a card.)	1	1
Nevinyrral's Disk	{4}	None	Artifact	None	Nevinyrral's Disk enters the battlefield tapped.|{1}, {T}: Destroy all artifacts, creatures, and enchantments.		
Nomad Outpost		None	Land	None	Nomad Outpost enters the battlefield tapped.|{T}: Add {R}, {W}, or {B} to your mana pool.		
Oath of Druids	{1}{G}	None	Enchantment	None	At the beginning of each player's upkeep, that player chooses target player who controls more creatures than he or she does and is his or her opponent. The first player may reveal cards from the top of his or her library until he or she reveals a creature card. If he or she does, that player puts that card onto the battlefield and all other cards revealed this way into his or her graveyard.		
Oblation	{2}{W}	None	Instant	None	The owner of target nonland permanent shuffles it into his or her library, then draws two cards.		
Opal Palace		None	Land	None	{T}: Add  to your mana pool.|{1}, {T}: Add to your mana pool one mana of any color in your commander's color identity. If you spend this mana to cast your commander, it enters the battlefield with a number of additional +1/+1 counters on it equal to the number of times it's been cast from the command zone this game.		
Open the Vaults	{4}{W}{W}	None	Sorcery	None	Return all artifact and enchantment cards from all graveyards to the battlefield under their owners' control. (Auras with nothing to enchant remain in graveyards.)		
Opulent Palace		None	Land	None	Opulent Palace enters the battlefield tapped.|{T}: Add {B}, {G}, or {U} to your mana pool.		
Order // Chaos (Order)	{3}{W}	None	Instant	None	Exile target attacking creature.|		
Orzhov Advokist	{2}{W}	None	Creature	Human,Advisor	At the beginning of your upkeep, each player may put two +1/+1 counters on a creature he or she controls. If a player does, creatures that player controls can't attack you or a planeswalker you control until your next turn.	1	4
Orzhov Basilica		None	Land	None	Orzhov Basilica enters the battlefield tapped.|When Orzhov Basilica enters the battlefield, return a land you control to its owner's hand.|{T}: Add {W}{B} to your mana pool.		
Orzhov Signet	{2}	None	Artifact	None	{1}, {T}: Add {W}{B} to your mana pool.		
Parting Thoughts	{2}{B}	None	Sorcery	None	Destroy target creature. You draw X cards and you lose X life, where X is the number of counters on that creature.		
Past in Flames	{3}{R}	None	Sorcery	None	Each instant and sorcery card in your graveyard gains flashback until end of turn. The flashback cost is equal to its mana cost.|Flashback {4}{R} (You may cast this card from your graveyard for its flashback cost. Then exile it.)		
Phyrexian Rebirth	{4}{W}{W}	None	Sorcery	None	Destroy all creatures, then create an X/X colorless Horror artifact creature token, where X is the number of creatures destroyed this way.		
Plains		Basic	Land	Plains	W		
Primeval Protector	{10}{G}	None	Creature	Avatar	Primeval Protector costs {1} less to cast for each creature your opponents control.|When Primeval Protector enters the battlefield, put a +1/+1 counter on each other creature you control.	10	10
Prismatic Geoscope	{5}	None	Artifact	None	Prismatic Geoscope enters the battlefield tapped.|Domain - {T}: Add X mana in any combination of colors to your mana pool, where X is the number of basic land types among lands you control.		
Progenitor Mimic	{4}{G}{U}	None	Creature	Shapeshifter	You may have Progenitor Mimic enter the battlefield as a copy of any creature on the battlefield, except it gains 'At the beginning of your upkeep, if this creature isn't a token, create a token that's a copy of this creature.'	0	0
Propaganda	{2}{U}	None	Enchantment	None	Creatures can't attack you unless their controller pays {2} for each creature he or she controls that's attacking you.		
Psychosis Crawler	{5}	None	Artifact,Creature	Horror	Psychosis Crawler's power and toughness are each equal to the number of cards in your hand.|Whenever you draw a card, each opponent loses 1 life.	*	*
Putrefy	{1}{B}{G}	None	Instant	None	Destroy target artifact or creature. It can't be regenerated.		
Quirion Explorer	{1}{G}	None	Creature	Elf,Druid,Scout	{T}: Add to your mana pool one mana of any color that a land an opponent controls could produce.	1	1
Rakdos Carnarium		None	Land	None	Rakdos Carnarium enters the battlefield tapped.|When Rakdos Carnarium enters the battlefield, return a land you control to its owner's hand.|{T}: Add {B}{R} to your mana pool.		
Rakdos Charm	{B}{R}	None	Instant	None	Choose one -|• Exile all cards from target player's graveyard.|• Destroy target artifact.|• Each creature deals 1 damage to its controller.		
Rakdos Signet	{2}	None	Artifact	None	{1}, {T}: Add {B}{R} to your mana pool.		
Rampant Growth	{1}{G}	None	Sorcery	None	Search your library for a basic land card and put that card onto the battlefield tapped. Then shuffle your library.		
Ravos, Soultender	{3}{W}{B}	Legendary	Creature	Human,Cleric	Flying|Other creatures you control get +1/+1.|At the beginning of your upkeep, you may return target creature card from your graveyard to your hand.|Partner (You can have two commanders if both have partner.)	2	2
Read the Runes	{X}{U}	None	Instant	None	Draw X cards. For each card drawn this way, discard a card unless you sacrifice a permanent.		
Realm Seekers	{4}{G}{G}	None	Creature	Elf,Scout	Realm Seekers enters the battlefield with X +1/+1 counters on it, where X is the total number of cards in all players' hands.|{2}{G}, Remove a +1/+1 counter from Realm Seekers: Search your library for a land card, reveal it, put it into your hand, then shuffle your library.	0	0
Reforge the Soul	{3}{R}{R}	None	Sorcery	None	Each player discards his or her hand, then draws seven cards.|Miracle {1}{R} (You may cast this card for its miracle cost when you draw it if it's the first card you drew this turn.)		
Reins of Power	{2}{U}{U}	None	Instant	None	Untap all creatures you control and all creatures target opponent controls. You and that opponent each gain control of all creatures the other controls until end of turn. Those creatures gain haste until end of turn.		
Reliquary Tower		None	Land	None	You have no maximum hand size.|{T}: Add  to your mana pool.		
Reveillark	{4}{W}	None	Creature	Elemental	Flying|When Reveillark leaves the battlefield, return up to two target creature cards with power 2 or less from your graveyard to the battlefield.|Evoke {5}{W} (You may cast this spell for its evoke cost. If you do, it's sacrificed when it enters the battlefield.)	4	3
Reverse the Sands	{6}{W}{W}	None	Sorcery	None	Redistribute any number of players' life totals. (Each of those players gets one life total back.)		
Reyhan, Last of the Abzan	{1}{B}{G}	Legendary	Creature	Human,Warrior	Reyhan, Last of the Abzan enters the battlefield with three +1/+1 counters on it.|Whenever a creature you control dies or is put into the command zone, if it had one or more +1/+1 counters on it, you may put that many +1/+1 counters on target creature.|Partner (You can have two commanders if both have partner.)	0	0
Rites of Flourishing	{2}{G}	None	Enchantment	None	At the beginning of each player's draw step, that player draws an additional card.|Each player may play an additional land on each of his or her turns.		
Rootbound Crag		None	Land	None	Rootbound Crag enters the battlefield tapped unless you control a Mountain or a Forest.|{T}: Add {R} or {G} to your mana pool.		
Rubblehulk	{4}{R}{G}	None	Creature	Elemental	Rubblehulk's power and toughness are each equal to the number of lands you control.|Bloodrush - {1}{R}{G}, Discard Rubblehulk: Target attacking creature gets +X/+X until end of turn, where X is the number of lands you control.	*	*
Rugged Highlands		None	Land	None	Rugged Highlands enters the battlefield tapped.|When Rugged Highlands enters the battlefield, you gain 1 life.|{T}: Add {R} or {G} to your mana pool.		
Runehorn Hellkite	{5}{R}	None	Creature	Dragon	Flying|{5}{R}, Exile Runehorn Hellkite from your graveyard: Each player discards his or her hand, then draws seven cards.	5	5
Rupture Spire		None	Land	None	Rupture Spire enters the battlefield tapped.|When Rupture Spire enters the battlefield, sacrifice it unless you pay {1}.|{T}: Add one mana of any color to your mana pool.		
Sakura-Tribe Elder	{1}{G}	None	Creature	Snake,Shaman	Sacrifice Sakura-Tribe Elder: Search your library for a basic land card, put that card onto the battlefield tapped, then shuffle your library.	1	1
Sanctum Gargoyle	{3}{W}	None	Artifact,Creature	Gargoyle	Flying|When Sanctum Gargoyle enters the battlefield, you may return target artifact card from your graveyard to your hand.	2	3
Sandsteppe Citadel		None	Land	None	Sandsteppe Citadel enters the battlefield tapped.|{T}: Add {W}, {B}, or {G} to your mana pool.		
