Name	ManaCost	SuperType	Types	SubTypes	Text	Power	Toughness
Sangromancer	{2}{B}{B}	None	Creature	Vampire,Shaman	Flying|Whenever a creature an opponent controls dies, you may gain 3 life.|Whenever an opponent discards a card, you may gain 3 life.	3	3
Saskia the Unyielding	{B}{R}{G}{W}	Legendary	Creature	Human,Soldier	Vigilance, haste|As Saskia the Unyielding enters the battlefield, choose a player.|Whenever a creature you control deals combat damage to a player, it deals that much damage to the chosen player.	3	4
Satyr Wayfinder	{1}{G}	None	Creature	Satyr	When Satyr Wayfinder enters the battlefield, reveal the top four cards of your library. You may put a land card from among them into your hand. Put the rest into your graveyard.	1	1
Savage Lands		None	Land	None	Savage Lands enters the battlefield tapped.|{T}: Add {B}, {R}, or {G} to your mana pool.		
Scavenging Ooze	{1}{G}	None	Creature	Ooze	{G}: Exile target card from a graveyard. If it was a creature card, put a +1/+1 counter on Scavenging Ooze and you gain 1 life.	2	2
Seaside Citadel		None	Land	None	Seaside Citadel enters the battlefield tapped.|{T}: Add {G}, {W}, or {U} to your mana pool.		
Seat of the Synod		None	Artifact,Land	None	(Seat of the Synod isn't a spell.)|{T}: Add {U} to your mana pool.		
Seeds of Renewal	{6}{G}	None	Sorcery	None	Undaunted (This spell costs {1} less to cast for each opponent.)|Return up to two target cards from your graveyard to your hand. Exile Seeds of Renewal.		
Selesnya Guildmage	{G/W}{G/W}	None	Creature	Elf,Wizard	{3}{G}: Create a 1/1 green Saproling creature token.|{3}{W}: Creatures you control get +1/+1 until end of turn.	2	2
Selesnya Sanctuary		None	Land	None	Selesnya Sanctuary enters the battlefield tapped.|When Selesnya Sanctuary enters the battlefield, return a land you control to its owner's hand.|{T}: Add {G}{W} to your mana pool.		
Selfless Squire	{3}{W}	None	Creature	Human,Soldier	Flash|When Selfless Squire enters the battlefield, prevent all damage that would be dealt to you this turn.|Whenever damage that would be dealt to you is prevented, put that many +1/+1 counters on Selfless Squire.	1	1
Selvala, Explorer Returned	{1}{G}{W}	Legendary	Creature	Elf,Scout	Parley - {T}: Each player reveals the top card of his or her library. For each nonland card revealed this way, add {G} to your mana pool and you gain 1 life. Then each player draws a card.	2	4
Shadowblood Ridge		None	Land	None	{1}, {T}: Add {B}{R} to your mana pool.		
Shamanic Revelation	{3}{G}{G}	None	Sorcery	None	Draw a card for each creature you control.|Ferocious - You gain 4 life for each creature you control with power 4 or greater.		
Sharuum the Hegemon	{3}{W}{U}{B}	Legendary	Artifact,Creature	Sphinx	Flying|When Sharuum the Hegemon enters the battlefield, you may return target artifact card from your graveyard to the battlefield.	5	5
Shimmer Myr	{3}	None	Artifact,Creature	Myr	Flash|You may cast artifact spells as though they had flash.	2	2
Sidar Kondo of Jamuraa	{2}{G}{W}	Legendary	Creature	Human,Knight	Flanking (Whenever a creature without flanking blocks this creature, the blocking creature gets -1/-1 until end of turn.)|Creatures your opponents control without flying or reach can't block creatures with power 2 or less.|Partner (You can have two commanders if both have partner.)	2	5
Silas Renn, Seeker Adept	{1}{U}{B}	Legendary	Artifact,Creature	Human	Deathtouch|Whenever Silas Renn, Seeker Adept deals combat damage to a player, choose target artifact card in your graveyard. You may cast that card this turn.|Partner (You can have two commanders if both have partner.)	2	2
Simic Growth Chamber		None	Land	None	Simic Growth Chamber enters the battlefield tapped.|When Simic Growth Chamber enters the battlefield, return a land you control to its owner's hand.|{T}: Add {G}{U} to your mana pool.		
Simic Signet	{2}	None	Artifact	None	{1}, {T}: Add {G}{U} to your mana pool.		
Skullclamp	{1}	None	Artifact	Equipment	Equipped creature gets +1/-1.|Whenever equipped creature dies, draw two cards.|Equip {1}		
Slobad, Goblin Tinkerer	{1}{R}	Legendary	Creature	Goblin,Artificer	Sacrifice an artifact: Target artifact gains indestructible until end of turn.	1	2
Sol Ring	{1}	None	Artifact	None	{T}: Add  to your mana pool.		
Solemn Simulacrum	{4}	None	Artifact,Creature	Golem	When Solemn Simulacrum enters the battlefield, you may search your library for a basic land card, put that card onto the battlefield tapped, then shuffle your library.|When Solemn Simulacrum dies, you may draw a card.	2	2
Solidarity of Heroes	{1}{G}	None	Instant	None	Strive - Solidarity of Heroes costs {1}{G} more to cast for each target beyond the first.|Choose any number of target creatures. Double the number of +1/+1 counters on each of them.		
Soul of New Phyrexia	{6}	None	Artifact,Creature	Avatar	Trample|{5}: Permanents you control gain indestructible until end of turn.|{5}, Exile Soul of New Phyrexia from your graveyard: Permanents you control gain indestructible until end of turn.	6	6
Spellheart Chimera	{1}{U}{R}	None	Creature	Chimera	Flying, trample|Spellheart Chimera's power is equal to the number of instant and sorcery cards in your graveyard.	*	3
Spelltwine	{5}{U}	None	Sorcery	None	Exile target instant or sorcery card from your graveyard and target instant or sorcery card from an opponent's graveyard. Copy those cards. Cast the copies if able without paying their mana costs. Exile Spelltwine.		
Sphere of Safety	{4}{W}	None	Enchantment	None	Creatures can't attack you or a planeswalker you control unless their controller pays {X} for each of those creatures, where X is the number of enchantments you control.		
Sphinx Summoner	{3}{U}{B}	None	Artifact,Creature	Sphinx	Flying|When Sphinx Summoner enters the battlefield, you may search your library for an artifact creature card, reveal it, and put it into your hand. If you do, shuffle your library.	3	3
Spinerock Knoll		None	Land	None	Hideaway (This land enters the battlefield tapped. When it does, look at the top four cards of your library, exile one face down, then put the rest on the bottom of your library.)|{T}: Add {R} to your mana pool.|{R}, {T}: You may play the exiled card without paying its mana cost if an opponent was dealt 7 or more damage this turn.		
Spitting Image	{4}{G/U}{G/U}	None	Sorcery	None	Create a token that's a copy of target creature.|Retrace (You may cast this card from your graveyard by discarding a land card in addition to paying its other costs.)		
Stalking Vengeance	{5}{R}{R}	None	Creature	Avatar	Haste|Whenever another creature you control dies, it deals damage equal to its power to target player.	5	5
Stonehoof Chieftain	{7}{G}	None	Creature	Centaur,Warrior	Trample, indestructible|Whenever another creature you control attacks, it gains trample and indestructible until end of turn.	8	8
Sublime Exhalation	{6}{W}	None	Sorcery	None	Undaunted (This spell costs {1} less to cast for each opponent.)|Destroy all creatures.		
Sunforger	{3}	None	Artifact	Equipment	Equipped creature gets +4/+0.|{R}{W}, Unattach Sunforger: Search your library for a red or white instant card with converted mana cost 4 or less and cast that card without paying its mana cost. Then shuffle your library.|Equip {3}		
Sungrass Prairie		None	Land	None	{1}, {T}: Add {G}{W} to your mana pool.		
Sunpetal Grove		None	Land	None	Sunpetal Grove enters the battlefield tapped unless you control a Forest or a Plains.|{T}: Add {G} or {W} to your mana pool.		
Swamp		Basic	Land	Swamp	B		
Swan Song	{U}	None	Instant	None	Counter target enchantment, instant, or sorcery spell. Its controller creates a 2/2 blue Bird creature token with flying.		
Swiftfoot Boots	{2}	None	Artifact	Equipment	Equipped creature has hexproof and haste.|Equip {1}		
Swiftwater Cliffs		None	Land	None	Swiftwater Cliffs enters the battlefield tapped.|When Swiftwater Cliffs enters the battlefield, you gain 1 life.|{T}: Add {U} or {R} to your mana pool.		
Swords to Plowshares	{W}	None	Instant	None	Exile target creature. Its controller gains life equal to its power.		
Sydri, Galvanic Genius	{W}{U}{B}	Legendary	Creature	Human,Artificer	{U}: Target noncreature artifact becomes an artifact creature with power and toughness each equal to its converted mana cost until end of turn.|{W}{B}: Target artifact creature gains deathtouch and lifelink until end of turn.	2	2
Sylvan Reclamation	{3}{G}{W}	None	Instant	None	Exile up to two target artifacts and/or enchantments.|Basic landcycling {2} ({2}, Discard this card: Search your library for a basic land card, reveal it, and put it into your hand. Then shuffle your library.)		
Sylvok Explorer	{1}{G}	None	Creature	Human,Druid	{T}: Add to your mana pool one mana of any color that a land an opponent controls could produce.	1	1
Tana, the Bloodsower	{2}{R}{G}	Legendary	Creature	Elf,Druid	Trample|Whenever Tana, the Bloodsower deals combat damage to a player, create that many 1/1 green Saproling creature tokens.|Partner (You can have two commanders if both have partner.)	2	2
Taurean Mauler	{2}{R}	None	Creature	Shapeshifter	Changeling (This card is every creature type.)|Whenever an opponent casts a spell, you may put a +1/+1 counter on Taurean Mauler.	2	2
Temple Bell	{3}	None	Artifact	None	{T}: Each player draws a card.		
Temple of the False God		None	Land	None	{T}: Add  to your mana pool. Activate this ability only if you control five or more lands.		
Tempt with Discovery	{3}{G}	None	Sorcery	None	Tempting offer - Search your library for a land card and put it onto the battlefield. Each opponent may search his or her library for a land card and put it onto the battlefield. For each opponent who searches a library this way, search your library for a land card and put it onto the battlefield. Then each player who searched a library this way shuffles it.		
Terminate	{B}{R}	None	Instant	None	Destroy target creature. It can't be regenerated.		
Terramorphic Expanse		None	Land	None	{T}, Sacrifice Terramorphic Expanse: Search your library for a basic land card and put it onto the battlefield tapped. Then shuffle your library.		
Tezzeret's Gambit	{3}{U/P}	None	Sorcery	None	({U/P} can be paid with either {U} or 2 life.)|Draw two cards, then proliferate. (You choose any number of permanents and/or players with counters on them, then give each another counter of a kind already there.)		
Thelonite Hermit	{3}{G}	None	Creature	Elf,Shaman	Saproling creatures get +1/+1.|Morph {3}{G}{G} (You may cast this card face down as a 2/2 creature for {3}. Turn it face up any time for its morph cost.)|When Thelonite Hermit is turned face up, create four 1/1 green Saproling creature tokens.	1	1
Thopter Foundry	{W/B}{U}	None	Artifact	None	{1}, Sacrifice a nontoken artifact: Create a 1/1 blue Thopter artifact creature token with flying. You gain 1 life.		
Thornwood Falls		None	Land	None	Thornwood Falls enters the battlefield tapped.|When Thornwood Falls enters the battlefield, you gain 1 life.|{T}: Add {G} or {U} to your mana pool.		
Thrasios, Triton Hero	{G}{U}	Legendary	Creature	Merfolk,Wizard	{4}: Scry 1, then reveal the top card of your library. If it's a land card, put it onto the battlefield tapped. Otherwise, draw a card.|Partner (You can have two commanders if both have partner.)	1	3
Thrummingbird	{1}{U}	None	Creature	Bird,Horror	Flying|Whenever Thrummingbird deals combat damage to a player, proliferate. (You choose any number of permanents and/or players with counters on them, then give each another counter of a kind already there.)	1	1
Thunderfoot Baloth	{4}{G}{G}	None	Creature	Beast	Trample|Lieutenant - As long as you control your commander, Thunderfoot Baloth gets +2/+2 and other creatures you control get +2/+2 and have trample.	5	5
Trading Post	{4}	None	Artifact	None	{1}, {T}, Discard a card: You gain 4 life.|{1}, {T}, Pay 1 life: Create a 0/1 white Goat creature token.|{1}, {T}, Sacrifice a creature: Return target artifact card from your graveyard to your hand.|{1}, {T}, Sacrifice an artifact: Draw a card.		
Transguild Promenade		None	Land	None	Transguild Promenade enters the battlefield tapped.|When Transguild Promenade enters the battlefield, sacrifice it unless you pay {1}.|{T}: Add one mana of any color to your mana pool.		
Trash for Treasure	{2}{R}	None	Sorcery	None	As an additional cost to cast Trash for Treasure, sacrifice an artifact.|Return target artifact card from your graveyard to the battlefield.		
Treacherous Terrain	{6}{R}{G}	None	Sorcery	None	Treacherous Terrain deals damage to each opponent equal to the number of lands that player controls.|Basic landcycling {2} ({2}, Discard this card: Search your library for a basic land card, reveal it, and put it into your hand. Then shuffle your library.)		
Treasure Cruise	{7}{U}	None	Sorcery	None	Delve (Each card you exile from your graveyard while casting this spell pays for {1}.)|Draw three cards.		
Trial // Error (Trial)	{W}{U}	None	Instant	None	Return all creatures blocking or blocked by target creature to their owner's hand.|		
Trinket Mage	{2}{U}	None	Creature	Human,Wizard	When Trinket Mage enters the battlefield, you may search your library for an artifact card with converted mana cost 1 or less, reveal that card, and put it into your hand. If you do, shuffle your library.	2	2
Tuskguard Captain	{2}{G}	None	Creature	Human,Warrior	Outlast {G} ({G}, {T}: Put a +1/+1 counter on this creature. Outlast only as a sorcery.)|Each creature you control with a +1/+1 counter on it has trample.	2	3
Tymna the Weaver	{1}{W}{B}	Legendary	Creature	Human,Cleric	Lifelink|At the beginning of your postcombat main phase, you may pay X life, where X is the number of opponents that were dealt combat damage this turn. If you do, draw X cards.|Partner (You can have two commanders if both have partner.)	2	2
Underground River		None	Land	None	{T}: Add  to your mana pool.|{T}: Add {U} or {B} to your mana pool. Underground River deals 1 damage to you.		
Utter End	{2}{W}{B}	None	Instant	None	Exile target nonland permanent.		
Vedalken Engineer	{1}{U}	None	Creature	Vedalken,Artificer	{T}: Add two mana of any one color to your mana pool. Spend this mana only to cast artifact spells or activate abilities of artifacts.	1	1
Venser's Journal	{5}	None	Artifact	None	You have no maximum hand size.|At the beginning of your upkeep, you gain 1 life for each card in your hand.		
Veteran Explorer	{G}	None	Creature	Human,Soldier,Scout	When Veteran Explorer dies, each player may search his or her library for up to two basic land cards and put them onto the battlefield. Then each player who searched his or her library this way shuffles it.	1	1
Vial Smasher the Fierce	{1}{B}{R}	Legendary	Creature	Goblin,Berserker	Whenever you cast your first spell each turn, Vial Smasher the Fierce deals damage equal to that spell's converted mana cost to an opponent chosen at random.|Partner (You can have two commanders if both have partner.)	2	3
Volcanic Vision	{5}{R}{R}	None	Sorcery	None	Return target instant or sorcery card from your graveyard to your hand. Volcanic Vision deals damage equal to that card's converted mana cost to each creature your opponents control. Exile Volcanic Vision.		
Vorel of the Hull Clade	{1}{G}{U}	Legendary	Creature	Human,Merfolk	{G}{U}, {T}: Double the number of each kind of counter on target artifact, creature, or land.	1	4
Vulturous Zombie	{3}{B}{G}	None	Creature	Plant,Zombie	Flying|Whenever a card is put into an opponent's graveyard from anywhere, put a +1/+1 counter on Vulturous Zombie.	3	3
Wall of Blossoms	{1}{G}	None	Creature	Plant,Wall	Defender|When Wall of Blossoms enters the battlefield, draw a card.	0	4
Waste Not	{1}{B}	None	Enchantment	None	Whenever an opponent discards a creature card, create a 2/2 black Zombie creature token.|Whenever an opponent discards a land card, add {B}{B} to your mana pool.|Whenever an opponent discards a noncreature, nonland card, draw a card.		
Wave of Reckoning	{4}{W}	None	Sorcery	None	Each creature deals damage to itself equal to its power.		
Wheel of Fate		None	Sorcery	None	Suspend 4-{1}{R} (Rather than cast this card from your hand, pay {1}{R} and exile it with four time counters on it. At the beginning of your upkeep, remove a time counter. When the last is removed, cast it without paying its mana cost.)|Each player discards his or her hand, then draws seven cards.		
Whims of the Fates	{5}{R}	None	Sorcery	None	Starting with you, each player separates all permanents he or she controls into three piles. Then each player chooses one of his or her piles at random and sacrifices those permanents. (Piles can be empty.)		
Whipflare	{1}{R}	None	Sorcery	None	Whipflare deals 2 damage to each nonartifact creature.		
Whispering Madness	{2}{U}{B}	None	Sorcery	None	Each player discards his or her hand, then draws cards equal to the greatest number of cards a player discarded this way.|Cipher (Then you may exile this spell card encoded on a creature you control. Whenever that creature deals combat damage to a player, its controller may cast a copy of the encoded card without paying its mana cost.)		
Whispersilk Cloak	{3}	None	Artifact	Equipment	Equipped creature can't be blocked and has shroud. (It can't be the target of spells or abilities.)|Equip {2}		
Wight of Precinct Six	{1}{B}	None	Creature	Zombie	Wight of Precinct Six gets +1/+1 for each creature card in your opponents' graveyards.	1	1
Wild Beastmaster	{2}{G}	None	Creature	Human,Shaman	Whenever Wild Beastmaster attacks, each other creature you control gets +X/+X until end of turn, where X is Wild Beastmaster's power.	1	1
Wilderness Elemental	{1}{R}{G}	None	Creature	Elemental	Trample|Wilderness Elemental's power is equal to the number of nonbasic lands your opponents control.	*	3
Windborn Muse	{3}{W}	None	Creature	Spirit	Flying|Creatures can't attack you unless their controller pays {2} for each creature he or she controls that's attacking you.	2	3
Windbrisk Heights		None	Land	None	Hideaway (This land enters the battlefield tapped. When it does, look at the top four cards of your library, exile one face down, then put the rest on the bottom of your library.)|{T}: Add {W} to your mana pool.|{W}, {T}: You may play the exiled card without paying its mana cost if you attacked with three or more creatures this turn.		
Windfall	{2}{U}	None	Sorcery	None	Each player discards his or her hand, then draws cards equal to the greatest number of cards a player discarded this way.		
Worm Harvest	{2}{B/G}{B/G}{B/G}	None	Sorcery	None	Create a 1/1 black and green Worm creature token for each land card in your graveyard.|Retrace (You may cast this card from your graveyard by discarding a land card in addition to paying its other costs.)		
Yidris, Maelstrom Wielder	{U}{B}{R}{G}	Legendary	Creature	Ogre,Wizard	Trample|Whenever Yidris, Maelstrom Wielder deals combat damage to a player, as you cast spells from your hand this turn, they gain cascade. (When you cast the spell, exile cards from the top of your library until you exile a nonland card that costs less. You may cast it without paying its mana cost. Put the exiled cards on the bottom of your library in a random order.)	5	4
Zedruu the Greathearted	{1}{R}{W}{U}	Legendary	Creature	Minotaur,Monk	At the beginning of your upkeep, you gain X life and draw X cards, where X is the number of permanents you own that your opponents control.|{R}{W}{U}: Target opponent gains control of target permanent you control.	2	4
Zhur-Taa Druid	{R}{G}	None	Creature	Human,Druid	{T}: Add {G} to your mana pool.|Whenever you tap Zhur-Taa Druid for mana, it deals 1 damage to each opponent.	1	1
