Name	ManaCost	SuperType	Types	SubTypes	Text	Power	Toughness
Wall of Water	{1}{U}{U}		Creature	Wall	Defender (This creature can't attack.)|{U}: Wall of Water gets +1/+0 until end of turn.	0	5
Wall of Wood	{G}		Creature	Wall	Defender (This creature can't attack.)	0	3
Wanderlust	{2}{G}		Enchantment	Aura	Enchant creature|At the beginning of the upkeep of enchanted creature's controller, Wanderlust deals 1 damage to that player.		
War Mammoth	{3}{G}		Creature	Elephant	Trample	3	3
Warp Artifact	{B}{B}		Enchantment	Aura	Enchant artifact|At the beginning of the upkeep of enchanted artifact's controller, Warp Artifact deals 1 damage to that player.		
Water Elemental	{3}{U}{U}		Creature	Elemental		5	4
Weakness	{B}		Enchantment	Aura	Enchant creature|Enchanted creature gets -2/-1.		
Web	{G}		Enchantment	Aura	Enchant creature (Target a creature as you cast this. This card enters the battlefield attached to that creature.)|Enchanted creature gets +0/+2 and has reach. (It can block creatures with flying.)		
Whirling Dervish	{G}{G}		Creature	Human,Monk	Protection from black|At the beginning of each end step, if Whirling Dervish dealt damage to an opponent this turn, put a +1/+1 counter on it.	1	1
White Knight	{W}{W}		Creature	Human,Knight	First strike (This creature deals combat damage before creatures without first strike.)|Protection from black (This creature can't be blocked, targeted, dealt damage, or enchanted by anything black.)	2	2
White Mana Battery	{4}		Artifact		{2}, {T}: Put a charge counter on White Mana Battery.|{T}, Remove any number of charge counters from White Mana Battery: Add {W} to your mana pool, then add an additional {W} to your mana pool for each charge counter removed this way.		
White Ward	{W}		Enchantment	Aura	Enchant creature|Enchanted creature has protection from white. This effect doesn't remove White Ward.		
Wild Growth	{G}		Enchantment	Aura	Enchant land|Whenever enchanted land is tapped for mana, its controller adds {G} to his or her mana pool (in addition to the mana the land produces).		
Will-O'-The-Wisp (Will-o'-the-Wisp)	{B}		Creature	Spirit	Flying (This creature can't be blocked except by creatures with flying or reach.)|{B}: Regenerate Will-o'-the-Wisp. (The next time this creature would be destroyed this turn, it isn't. Instead tap it, remove all damage from it, and remove it from combat.)	0	1
Winds of Change	{R}		Sorcery		Each player shuffles the cards from his or her hand into his or her library, then draws that many cards.		
Winter Blast	{X}{G}		Sorcery		Tap X target creatures. Winter Blast deals 2 damage to each of those creatures with flying.		
Winter Orb	{2}		Artifact		Players can't untap more than one land during their untap steps.		
Wooden Sphere	{1}		Artifact		Whenever a player casts a green spell, you may pay {1}. If you do, you gain 1 life.		
Word of Binding	{X}{B}{B}		Sorcery		Tap X target creatures.		
Wrath of God	{2}{W}{W}		Sorcery		Destroy all creatures. They can't be regenerated.		
Xenic Poltergeist	{1}{B}{B}		Creature	Spirit	{T}: Until your next upkeep, target noncreature artifact becomes an artifact creature with power and toughness each equal to its converted mana cost.	1	1
Yotian Soldier	{3}		Artifact,Creature	Soldier	Vigilance	1	4
Zephyr Falcon	{1}{U}		Creature	Bird	Flying, vigilance	1	1
Zombie Master	{1}{B}{B}		Creature	Zombie	Other Zombie creatures have swampwalk.|Other Zombies have '{B}: Regenerate this permanent.'	2	3
