Name	ManaCost	SuperType	Types	SubTypes	Text	Power	Toughness
Wall of Shadows	{1}{B}{B}		Creature	Wall	Defender (This creature can't attack.)|Prevent all damage that would be dealt to Wall of Shadows by creatures it's blocking.|Wall of Shadows can't be the target of spells that can target only Walls or of abilities that can target only Walls.	0	1
Wall of Tombstones	{1}{B}		Creature	Wall	Defender (This creature can't attack.)|At the beginning of your upkeep, Wall of Tombstones's toughness becomes 1 plus the number of creature cards in your graveyard. (This effect lasts indefinitely.)	0	1
Wall of Vapor	{3}{U}		Creature	Wall	Defender (This creature can't attack.)|Prevent all damage that would be dealt to Wall of Vapor by creatures it's blocking.	0	1
Wall of Wonder	{2}{U}{U}		Creature	Wall	Defender (This creature can't attack.)|{2}{U}{U}: Wall of Wonder gets +4/-4 until end of turn and can attack this turn as though it didn't have defender.	1	5
Whirling Dervish	{G}{G}		Creature	Human,Monk	Protection from black|At the beginning of each end step, if Whirling Dervish dealt damage to an opponent this turn, put a +1/+1 counter on it.	1	1
White Mana Battery	{4}		Artifact		{2}, {T}: Put a charge counter on White Mana Battery.|{T}, Remove any number of charge counters from White Mana Battery: Add {W} to your mana pool, then add an additional {W} to your mana pool for each charge counter removed this way.		
Willow Satyr	{2}{G}{G}		Creature	Satyr	You may choose not to untap Willow Satyr during your untap step.|{T}: Gain control of target legendary creature for as long as you control Willow Satyr and Willow Satyr remains tapped.	1	1
Winds of Change	{R}		Sorcery		Each player shuffles the cards from his or her hand into his or her library, then draws that many cards.		
Winter Blast	{X}{G}		Sorcery		Tap X target creatures. Winter Blast deals 2 damage to each of those creatures with flying.		
Wolverine Pack	{2}{G}{G}		Creature	Wolverine	Rampage 2 (Whenever this creature becomes blocked, it gets +2/+2 until end of turn for each creature blocking it beyond the first.)	2	4
Wood Elemental	{3}{G}		Creature	Elemental	As Wood Elemental enters the battlefield, sacrifice any number of untapped Forests.|Wood Elemental's power and toughness are each equal to the number of Forests sacrificed as it entered the battlefield.	*	*
Xira Arien	{B}{R}{G}	Legendary	Creature	Insect,Wizard	Flying|{B}{R}{G}, {T}: Target player draws a card.	1	2
Zephyr Falcon	{1}{U}		Creature	Bird	Flying, vigilance	1	1
