Name	ManaCost	SuperType	Types	SubTypes	Text	Power	Toughness
Northern Paladin	{2}{W}{W}		Creature	Human,Knight	{W}{W}, {T}: Destroy target black permanent.	3	3
Obsianus Golem	{6}		Artifact,Creature	Golem		4	6
Orcish Artillery	{1}{R}{R}		Creature	Orc,Warrior	{T}: Orcish Artillery deals 2 damage to target creature or player and 3 damage to you.	1	3
Orcish Oriflamme	{3}{R}		Enchantment		Attacking creatures you control get +1/+0.		
Paralyze	{B}		Enchantment	Aura	Enchant creature|When Paralyze enters the battlefield, tap enchanted creature.|Enchanted creature doesn't untap during its controller's untap step.|At the beginning of the upkeep of enchanted creature's controller, that player may pay {4}. If he or she does, untap the creature.		
Pearled Unicorn	{2}{W}		Creature	Unicorn		2	2
Personal Incarnation	{3}{W}{W}{W}		Creature	Avatar,Incarnation	{0}: The next 1 damage that would be dealt to Personal Incarnation this turn is dealt to its owner instead. Any player may activate this ability, but only if he or she owns Personal Incarnation.|When Personal Incarnation dies, its owner loses half his or her life, rounded up.	6	6
Pestilence	{2}{B}{B}		Enchantment		At the beginning of the end step, if no creatures are on the battlefield, sacrifice Pestilence.|{B}: Pestilence deals 1 damage to each creature and each player.		
Phantasmal Forces	{3}{U}		Creature	Illusion	Flying|At the beginning of your upkeep, sacrifice Phantasmal Forces unless you pay {U}.	4	1
Phantasmal Terrain	{U}{U}		Enchantment	Aura	Enchant land|As Phantasmal Terrain enters the battlefield, choose a basic land type.|Enchanted land is the chosen type.		
Phantom Monster	{3}{U}		Creature	Illusion	Flying	3	3
Pirate Ship	{4}{U}		Creature	Human,Pirate	Pirate Ship can't attack unless defending player controls an Island.|{T}: Pirate Ship deals 1 damage to target creature or player.|When you control no Islands, sacrifice Pirate Ship.	4	3
Plague Rats	{2}{B}		Creature	Rat	Plague Rats's power and toughness are each equal to the number of creatures named Plague Rats on the battlefield.	*	*
Plains		Basic	Land	Plains	W		
Plateau			Land	Mountain,Plains	Counts as both mountains and plains and is affected by spells that affect either. Tap to add either oR or oW to your mana pool.		
Power Leak	{1}{U}		Enchantment	Aura	Enchant enchantment|At the beginning of the upkeep of enchanted enchantment's controller, that player may pay any amount of mana. Power Leak deals 2 damage to that player. Prevent X of that damage, where X is the amount of mana that player paid this way.		
Power Sink	{X}{U}		Instant		Counter target spell unless its controller pays {X}. If he or she doesn't, that player taps all lands with mana abilities he or she controls and empties his or her mana pool.		
Power Surge	{R}{R}		Enchantment		At the beginning of each player's upkeep, Power Surge deals X damage to that player, where X is the number of untapped lands he or she controlled at the beginning of this turn.		
Prodigal Sorcerer	{2}{U}		Creature	Human,Wizard	{T}: Prodigal Sorcerer deals 1 damage to target creature or player.	1	1
Psionic Blast	{2}{U}		Instant		Psionic Blast deals 4 damage to target creature or player and 2 damage to you.		
Psychic Venom	{1}{U}		Enchantment	Aura	Enchant land|Whenever enchanted land becomes tapped, Psychic Venom deals 2 damage to that land's controller.		
Purelace	{W}		Instant		Target spell or permanent becomes white. (Mana symbols on that permanent remain unchanged.)		
Raging River	{R}{R}		Enchantment		Whenever one or more creatures you control attack, each defending player divides all creatures without flying he or she controls into a 'left' pile and a 'right' pile. Then, for each attacking creature you control, choose 'left' or 'right.' That creature can't be blocked this combat except by creatures with flying and creatures in a pile with the chosen label.		
Raise Dead	{B}		Sorcery		Return target creature card from your graveyard to your hand.		
Red Elemental Blast	{R}		Instant		Choose one - Counter target blue spell; or destroy target blue permanent.		
Red Ward	{W}		Enchantment	Aura	Enchant creature|Enchanted creature has protection from red. This effect doesn't remove Red Ward.		
Regeneration	{1}{G}		Enchantment	Aura	Enchant creature (Target a creature as you cast this. This card enters the battlefield attached to that creature.)|{G}: Regenerate enchanted creature. (The next time that creature would be destroyed this turn, it isn't. Instead tap it, remove all damage from it, and remove it from combat.)		
Regrowth	{1}{G}		Sorcery		Return target card from your graveyard to your hand.		
Resurrection	{2}{W}{W}		Sorcery		Return target creature card from your graveyard to the battlefield.		
Reverse Damage	{1}{W}{W}		Instant		The next time a source of your choice would deal damage to you this turn, prevent that damage. You gain life equal to the damage prevented this way.		
Righteousness	{W}		Instant		Target blocking creature gets +7/+7 until end of turn.		
Roc of Kher Ridges	{3}{R}		Creature	Bird	Flying	3	3
Rock Hydra	{X}{R}{R}		Creature	Hydra	Rock Hydra enters the battlefield with X +1/+1 counters on it.|For each 1 damage that would be dealt to Rock Hydra, if it has a +1/+1 counter on it, remove a +1/+1 counter from it and prevent that 1 damage.|{R}: Prevent the next 1 damage that would be dealt to Rock Hydra this turn.|{R}{R}{R}: Put a +1/+1 counter on Rock Hydra. Activate this ability only during your upkeep.	0	0
Rod of Ruin	{4}		Artifact		{3}, {T}: Rod of Ruin deals 1 damage to target creature or player.		
Royal Assassin	{1}{B}{B}		Creature	Human,Assassin	{T}: Destroy target tapped creature.	1	1
Sacrifice	{B}		Instant		As an additional cost to cast Sacrifice, sacrifice a creature.|Add to your mana pool an amount of {B} equal to the sacrificed creature's converted mana cost.		
Samite Healer	{1}{W}		Creature	Human,Cleric	{T}: Prevent the next 1 damage that would be dealt to target creature or player this turn.	1	1
Savannah			Land	Forest,Plains	Counts as both plains and forest and is affected by spells that affect either. Tap to add either oW or oG to your mana pool.		
Savannah Lions	{W}		Creature	Cat		2	1
Scathe Zombies	{2}{B}		Creature	Zombie		2	2
Scavenging Ghoul	{3}{B}		Creature	Zombie	At the beginning of each end step, put a corpse counter on Scavenging Ghoul for each creature that died this turn.|Remove a corpse counter from Scavenging Ghoul: Regenerate Scavenging Ghoul.	2	2
Scrubland			Land	Plains,Swamp	Counts as both plains and swamp and is affected by spells that affect either. Tap to add either oW or oB to your mana pool.		
Scryb Sprites	{G}		Creature	Faerie	Flying	1	1
Sea Serpent	{5}{U}		Creature	Serpent	Sea Serpent can't attack unless defending player controls an Island.||When you control no Islands, sacrifice Sea Serpent.	5	5
Sedge Troll	{2}{R}		Creature	Troll	Sedge Troll gets +1/+1 as long as you control a Swamp.|{B}: Regenerate Sedge Troll.	2	2
Sengir Vampire	{3}{B}{B}		Creature	Vampire	Flying|Whenever a creature dealt damage by Sengir Vampire this turn dies, put a +1/+1 counter on Sengir Vampire.	4	4
Serra Angel	{3}{W}{W}		Creature	Angel	Flying|Vigilance (Attacking doesn't cause this creature to tap.)	4	4
Shanodin Dryads	{G}		Creature	Nymph,Dryad	Forestwalk	1	1
Shatter	{1}{R}		Instant		Destroy target artifact.		
Shivan Dragon	{4}{R}{R}		Creature	Dragon	Flying|{R}: Shivan Dragon gets +1/+0 until end of turn.	5	5
Simulacrum	{1}{B}		Instant		You gain life equal to the damage dealt to you this turn. Simulacrum deals damage to target creature you control equal to the damage dealt to you this turn.		
Sinkhole	{B}{B}		Sorcery		Destroy target land.		
Siren's Call	{U}		Instant		Cast Siren's Call only during an opponent's turn, before attackers are declared.|Creatures the active player controls attack this turn if able.|At the beginning of the next end step, destroy all non-Wall creatures that player controls that didn't attack this turn. Ignore this effect for each creature the player didn't control continuously since the beginning of the turn.		
Sleight of Mind	{U}		Instant		Change the text of target spell or permanent by replacing all instances of one color word with another. (For example, you may change 'target black spell' to 'target blue spell.' This effect lasts indefinitely.)		
Smoke	{R}{R}		Enchantment		Players can't untap more than one creature during their untap steps.		
Sol Ring	{1}		Artifact		{T}: Add {2} to your mana pool.		
Soul Net	{1}		Artifact		Whenever a creature dies, you may pay {1}. If you do, you gain 1 life.		
Spell Blast	{X}{U}		Instant		Counter target spell with converted mana cost X. (For example, if that spell's mana cost is {3}{U}{U}, X is 5.)		
Stasis	{1}{U}		Enchantment		Players skip their untap steps.||At the beginning of your upkeep, sacrifice Stasis unless you pay {U}.		
Steal Artifact	{2}{U}{U}		Enchantment	Aura	Enchant artifact|You control enchanted artifact.		
Stone Giant	{2}{R}{R}		Creature	Giant	{T}: Target creature you control with toughness less than Stone Giant's power gains flying until end of turn. Destroy that creature at the beginning of the next end step.	3	4
Stone Rain	{2}{R}		Sorcery		Destroy target land.		
Stream of Life	{X}{G}		Sorcery		Target player gains X life.		
Sunglasses of Urza	{3}		Artifact		You may spend white mana as though it were red mana.		
Swamp		Basic	Land	Swamp	B		
Swords to Plowshares	{W}		Instant		Exile target creature. Its controller gains life equal to its power.		
Taiga			Land	Mountain,Forest	Counts as both forest and mountains and is affected by spells that affect either. Tap to add either oG or oR to your mana pool.		
Terror	{1}{B}		Instant		Destroy target nonartifact, nonblack creature. It can't be regenerated.		
The Hive	{5}		Artifact		{5}, {T}: Put a 1/1 colorless Insect artifact creature token with flying named Wasp onto the battlefield. (It can't be blocked except by creatures with flying or reach.)		
Thicket Basilisk	{3}{G}{G}		Creature	Basilisk	Whenever Thicket Basilisk blocks or becomes blocked by a non-Wall creature, destroy that creature at end of combat.	2	4
Thoughtlace	{U}		Instant		Target spell or permanent becomes blue. (Mana symbols on that permanent remain unchanged.)		
Throne of Bone	{1}		Artifact		Whenever a player casts a black spell, you may pay {1}. If you do, you gain 1 life.		
Timber Wolves	{G}		Creature	Wolf	Banding (Any creatures with banding, and up to one without, can attack in a band. Bands are blocked as a group. If any creatures with banding you control are blocking or being blocked by a creature, you divide that creature's combat damage, not its controller, among any of the creatures it's being blocked by or is blocking.)	1	1
Time Vault	{2}		Artifact		Time Vault enters the battlefield tapped.|Time Vault doesn't untap during your untap step.|If you would begin your turn while Time Vault is tapped, you may skip that turn instead. If you do, untap Time Vault.|{T}: Take an extra turn after this one.		
Time Walk	{1}{U}		Sorcery		Take an extra turn after this one.		
Timetwister	{2}{U}		Sorcery		Each player shuffles his or her hand and graveyard into his or her library, then draws seven cards. (Then put Timetwister into its owner's graveyard.)		
Tranquility	{2}{G}		Sorcery		Destroy all enchantments.		
Tropical Island			Land	Forest,Island	Counts as both forest and islands and is affected by spells that affect either. Tap to add either oG or oU to your mana pool.		
Tsunami	{3}{G}		Sorcery		Destroy all Islands.		
Tundra			Land	Plains,Island	Counts as both islands and plains and is affected by spells that affect either. Tap to add either oU or oW to your mana pool.		
Tunnel	{R}		Instant		Destroy target Wall. It can't be regenerated.		
Twiddle	{U}		Instant		You may tap or untap target artifact, creature, or land.		
Two-Headed Giant of Foriys	{4}{R}		Creature	Giant	Trample|Two-Headed Giant of Foriys can block an additional creature.	4	4
Underground Sea			Land	Island,Swamp	Counts as both swamp and islands and is affected by spells that affect either. Tap to add either oB or oU to your mana pool.		
Unholy Strength	{B}		Enchantment	Aura	Enchant creature|Enchanted creature gets +2/+1.		
Unsummon	{U}		Instant		Return target creature to its owner's hand.		
Uthden Troll	{2}{R}		Creature	Troll	{R}: Regenerate Uthden Troll.	2	2
Verduran Enchantress	{1}{G}{G}		Creature	Human,Druid	Whenever you cast an enchantment spell, you may draw a card.	0	2
Vesuvan Doppelganger	{3}{U}{U}		Creature	Shapeshifter	You may have Vesuvan Doppelganger enter the battlefield as a copy of any creature on the battlefield except it doesn't copy that creature's color and it gains 'At the beginning of your upkeep, you may have this creature become a copy of target creature except it doesn't copy that creature's color. If you do, this creature gains this ability.'	0	0
Veteran Bodyguard	{3}{W}{W}		Creature	Human	As long as Veteran Bodyguard is untapped, all damage that would be dealt to you by unblocked creatures is dealt to Veteran Bodyguard instead.	2	5
Volcanic Eruption	{X}{U}{U}{U}		Sorcery		Destroy X target Mountains. Volcanic Eruption deals damage to each creature and each player equal to the number of Mountains put into a graveyard this way.		
Wall of Air	{1}{U}{U}		Creature	Wall	Defender, flying (This creature can't attack, and it can block creatures with flying.)	1	5
Wall of Bone	{2}{B}		Creature	Skeleton,Wall	Defender (This creature can't attack.)|{B}: Regenerate Wall of Bone. (The next time this creature would be destroyed this turn, it isn't. Instead tap it, remove all damage from it, and remove it from combat.)	1	4
Wall of Brambles	{2}{G}		Creature	Plant,Wall	Defender (This creature can't attack.)|{G}: Regenerate Wall of Brambles.	2	3
Wall of Fire	{1}{R}{R}		Creature	Wall	Defender (This creature can't attack.)|{R}: Wall of Fire gets +1/+0 until end of turn.	0	5
Wall of Ice	{2}{G}		Creature	Wall	Defender (This creature can't attack.)	0	7
Wall of Stone	{1}{R}{R}		Creature	Wall	Defender (This creature can't attack.)	0	8
Wall of Swords	{3}{W}		Creature	Wall	Defender (This creature can't attack.)|Flying	3	5
Wall of Water	{1}{U}{U}		Creature	Wall	Defender (This creature can't attack.)|{U}: Wall of Water gets +1/+0 until end of turn.	0	5
Wall of Wood	{G}		Creature	Wall	Defender (This creature can't attack.)	0	3
Wanderlust	{2}{G}		Enchantment	Aura	Enchant creature|At the beginning of the upkeep of enchanted creature's controller, Wanderlust deals 1 damage to that player.		
War Mammoth	{3}{G}		Creature	Elephant	Trample	3	3
Warp Artifact	{B}{B}		Enchantment	Aura	Enchant artifact|At the beginning of the upkeep of enchanted artifact's controller, Warp Artifact deals 1 damage to that player.		
Water Elemental	{3}{U}{U}		Creature	Elemental		5	4
Weakness	{B}		Enchantment	Aura	Enchant creature|Enchanted creature gets -2/-1.		
Web	{G}		Enchantment	Aura	Enchant creature (Target a creature as you cast this. This card enters the battlefield attached to that creature.)|Enchanted creature gets +0/+2 and has reach. (It can block creatures with flying.)		
Wheel of Fortune	{2}{R}		Sorcery		Each player discards his or her hand and draws seven cards.		
White Knight	{W}{W}		Creature	Human,Knight	First strike (This creature deals combat damage before creatures without first strike.)|Protection from black (This creature can't be blocked, targeted, dealt damage, or enchanted by anything black.)	2	2
White Ward	{W}		Enchantment	Aura	Enchant creature|Enchanted creature has protection from white. This effect doesn't remove White Ward.		
Wild Growth	{G}		Enchantment	Aura	Enchant land|Whenever enchanted land is tapped for mana, its controller adds {G} to his or her mana pool (in addition to the mana the land produces).		
Will-O'-The-Wisp (Will-o'-the-Wisp)	{B}		Creature	Spirit	Flying (This creature can't be blocked except by creatures with flying or reach.)|{B}: Regenerate Will-o'-the-Wisp. (The next time this creature would be destroyed this turn, it isn't. Instead tap it, remove all damage from it, and remove it from combat.)	0	1
Winter Orb	{2}		Artifact		Players can't untap more than one land during their untap steps.		
Wooden Sphere	{1}		Artifact		Whenever a player casts a green spell, you may pay {1}. If you do, you gain 1 life.		
Word of Command	{B}{B}		Instant		Look at target opponent's hand and choose a card from it. You control that player until Word of Command finishes resolving. The player plays that card if able. While doing so, the player can activate mana abilities only if they're from lands he or she controls and only if mana they produce is spent to activate other mana abilities of lands he or she controls and/or play that card. If the chosen card is cast as a spell, you control the player while that spell is resolving.		
Wrath of God	{2}{W}{W}		Sorcery		Destroy all creatures. They can't be regenerated.		
Zombie Master	{1}{B}{B}		Creature	Zombie	Other Zombie creatures have swampwalk.|Other Zombies have '{B}: Regenerate this permanent.'	2	3
