Name	ManaCost	SuperType	Types	SubTypes	Text	Power	Toughness
Air Elemental	{3}{U}{U}		Creature	Elemental	Flying	4	4
Ancestral Recall	{U}		Instant		Target player draws three cards.		
Animate Artifact	{3}{U}		Enchantment	Aura	Enchant artifact|As long as enchanted artifact isn't a creature, it's an artifact creature with power and toughness each equal to its converted mana cost.		
Animate Dead	{1}{B}		Enchantment	Aura	Enchant creature card in a graveyard|When Animate Dead enters the battlefield, if it's on the battlefield, it loses 'enchant creature card in a graveyard' and gains 'enchant creature put onto the battlefield with Animate Dead.' Return enchanted creature card to the battlefield under your control and attach Animate Dead to it. When Animate Dead leaves the battlefield, that creature's controller sacrifices it.|Enchanted creature gets -1/-0.		
Animate Wall	{W}		Enchantment	Aura	Enchant Wall|Enchanted Wall can attack as though it didn't have defender.		
Ankh of Mishra	{2}		Artifact		Whenever a land enters the battlefield, Ankh of Mishra deals 2 damage to that land's controller.		
Armageddon	{3}{W}		Sorcery		Destroy all lands.		
Aspect of Wolf	{1}{G}		Enchantment	Aura	Enchant creature|Enchanted creature gets +X/+Y, where X is half the number of Forests you control, rounded down, and Y is half the number of Forests you control, rounded up.		
Bad Moon	{1}{B}		Enchantment		Black creatures get +1/+1.		
Badlands			Land	Swamp,Mountain	Counts as both mountains and swamp and is affected by spells that affect either. Tap to add either oR or oB to your mana pool.		
Balance	{1}{W}		Sorcery		Each player chooses a number of lands he or she controls equal to the number of lands controlled by the player who controls the fewest, then sacrifices the rest. Players discard cards and sacrifice creatures the same way.		
Basalt Monolith	{3}		Artifact		Basalt Monolith doesn't untap during your untap step.|{T}: Add {3} to your mana pool.|{3}: Untap Basalt Monolith.		
Bayou			Land	Swamp,Forest	Counts as both swamp and forest and is affected by spells that affect either. Tap to add either oB or oG to your mana pool.		
Benalish Hero	{W}		Creature	Human,Soldier	Banding (Any creatures with banding, and up to one without, can attack in a band. Bands are blocked as a group. If any creatures with banding you control are blocking or being blocked by a creature, you divide that creature's combat damage, not its controller, among any of the creatures it's being blocked by or is blocking.)	1	1
Berserk	{G}		Instant		Cast Berserk only before the combat damage step.|Target creature gains trample and gets +X/+0 until end of turn, where X is its power. At the beginning of the next end step, destroy that creature if it attacked this turn.		
Birds of Paradise	{G}		Creature	Bird	Flying|{T}: Add one mana of any color to your mana pool.	0	1
Black Knight	{B}{B}		Creature	Human,Knight	First strike (This creature deals combat damage before creatures without first strike.)|Protection from white (This creature can't be blocked, targeted, dealt damage, or enchanted by anything white.)	2	2
Black Lotus	{0}		Artifact		{T}, Sacrifice Black Lotus: Add three mana of any one color to your mana pool.		
Black Vise	{1}		Artifact		As Black Vise enters the battlefield, choose an opponent.|At the beginning of the chosen player's upkeep, Black Vise deals X damage to that player, where X is the number of cards in his or her hand minus 4.		
Black Ward	{W}		Enchantment	Aura	Enchant creature|Enchanted creature has protection from black. This effect doesn't remove Black Ward.		
Blaze of Glory	{W}		Instant		Cast Blaze of Glory only during combat before blockers are declared.|Target creature defending player controls can block any number of creatures this turn. It blocks each attacking creature this turn if able.		
Blessing	{W}{W}		Enchantment	Aura	Enchant creature|{W}: Enchanted creature gets +1/+1 until end of turn.		
Blue Elemental Blast	{U}		Instant		Choose one - Counter target red spell; or destroy target red permanent.		
Blue Ward	{W}		Enchantment	Aura	Enchant creature|Enchanted creature has protection from blue. This effect doesn't remove Blue Ward.		
Bog Wraith	{3}{B}		Creature	Wraith	Swampwalk (This creature can't be blocked as long as defending player controls a Swamp.)	3	3
Braingeyser	{X}{U}{U}		Sorcery		Target player draws X cards.		
Burrowing	{R}		Enchantment	Aura	Enchant creature|Enchanted creature has mountainwalk.		
Camouflage	{G}		Instant		Cast Camouflage only during your declare attackers step.|This turn, instead of declaring blockers, each defending player chooses any number of creatures he or she controls and divides them into a number of piles equal to the number of attacking creatures for whom that player is the defending player. Creatures he or she controls that can block additional creatures may likewise be put into additional piles. Assign each pile to a different one of those attacking creatures at random. Each creature in a pile that can block the creature that pile is assigned to does so. (Piles can be empty.)		
Castle	{3}{W}		Enchantment		Untapped creatures you control get +0/+2.		
Celestial Prism	{3}		Artifact		{2}, {T}: Add one mana of any color to your mana pool.		
Channel	{G}{G}		Sorcery		Until end of turn, any time you could activate a mana ability, you may pay 1 life. If you do, add {1} to your mana pool.		
Chaos Orb	{2}		Artifact		{1}, {T}: If Chaos Orb is on the battlefield, flip Chaos Orb onto the battlefield from a height of at least one foot. If Chaos Orb turns over completely at least once during the flip, destroy all nontoken permanents it touches. Then destroy Chaos Orb.		
Chaoslace	{R}		Instant		Target spell or permanent becomes red. (Its mana symbols remain unchanged.)		
Circle of Protection : Blue (Circle of Protection: Blue)	{1}{W}		Enchantment		{1}: The next time a blue source of your choice would deal damage to you this turn, prevent that damage.		
Circle of Protection : Green (Circle of Protection: Green)	{1}{W}		Enchantment		{1}: The next time a green source of your choice would deal damage to you this turn, prevent that damage.		
Circle of Protection : Red (Circle of Protection: Red)	{1}{W}		Enchantment		{1}: The next time a red source of your choice would deal damage to you this turn, prevent that damage.		
Circle of Protection : White (Circle of Protection: White)	{1}{W}		Enchantment		{1}: The next time a white source of your choice would deal damage to you this turn, prevent that damage.		
Clockwork Beast	{6}		Artifact,Creature	Beast	Clockwork Beast enters the battlefield with seven +1/+0 counters on it.|At end of combat, if Clockwork Beast attacked or blocked this combat, remove a +1/+0 counter from it.|{X}, {T}: Put up to X +1/+0 counters on Clockwork Beast. This ability can't cause the total number of +1/+0 counters on Clockwork Beast to be greater than seven. Activate this ability only during your upkeep.	0	4
Clone	{3}{U}		Creature	Shapeshifter	You may have Clone enter the battlefield as a copy of any creature on the battlefield.	0	0
Cockatrice	{3}{G}{G}		Creature	Cockatrice	Flying|Whenever Cockatrice blocks or becomes blocked by a non-Wall creature, destroy that creature at end of combat.	2	4
Consecrate Land	{W}		Enchantment	Aura	Enchant land|Enchanted land has indestructible and can't be enchanted by other Auras.		
Conservator	{4}		Artifact		{3}, {T}: Prevent the next 2 damage that would be dealt to you this turn.		
Contract from Below	{B}		Sorcery		Remove Contract from Below from your deck before playing if you're not playing for ante.|Discard your hand, add the top card of your library to the ante, then draw seven cards.		
Control Magic	{2}{U}{U}		Enchantment	Aura	Enchant creature|You control enchanted creature.		
Conversion	{2}{W}{W}		Enchantment		At the beginning of your upkeep, sacrifice Conversion unless you pay {W}{W}.|All Mountains are Plains.		
Copper Tablet	{2}		Artifact		At the beginning of each player's upkeep, Copper Tablet deals 1 damage to that player.		
Copy Artifact	{1}{U}		Enchantment		You may have Copy Artifact enter the battlefield as a copy of any artifact on the battlefield, except it's an enchantment in addition to its other types.		
Counterspell	{U}{U}		Instant		Counter target spell.		
Craw Wurm	{4}{G}{G}		Creature	Wurm		6	4
Creature Bond	{1}{U}		Enchantment	Aura	Enchant creature|When enchanted creature dies, Creature Bond deals damage equal to that creature's toughness to the creature's controller.		
Crusade	{W}{W}		Enchantment		White creatures get +1/+1.		
Crystal Rod	{1}		Artifact		Whenever a player casts a blue spell, you may pay {1}. If you do, you gain 1 life.		
Cursed Land	{2}{B}{B}		Enchantment	Aura	Enchant land|At the beginning of the upkeep of enchanted land's controller, Cursed Land deals 1 damage to that player.		
Cyclopean Tomb	{4}		Artifact		{2}, {T}: Put a mire counter on target non-Swamp land. That land is a Swamp for as long as it has a mire counter on it. Activate this ability only during your upkeep.|When Cyclopean Tomb is put into a graveyard from the battlefield, at the beginning of each of your upkeeps for the rest of the game, remove all mire counters from a land that a mire counter was put onto with Cyclopean Tomb but that a mire counter has not been removed from with Cyclopean Tomb.		
Dark Ritual	{B}		Instant		Add {B}{B}{B} to your mana pool.		
Darkpact	{B}{B}{B}		Sorcery		Remove Darkpact from your deck before playing if you're not playing for ante.|You own target card in the ante. Exchange that card with the top card of your library.		
Death Ward	{W}		Instant		Regenerate target creature.		
Deathgrip	{B}{B}		Enchantment		{B}{B}: Counter target green spell.		
Deathlace	{B}		Instant		Target spell or permanent becomes black. (Mana symbols on that permanent remain unchanged.)		
Demonic Attorney	{1}{B}{B}		Sorcery		Remove Demonic Attorney from your deck before playing if you're not playing for ante.|Each player antes the top card of his or her library.		
Demonic Hordes	{3}{B}{B}{B}		Creature	Demon	{T}: Destroy target land.|At the beginning of your upkeep, unless you pay {B}{B}{B}, tap Demonic Hordes and sacrifice a land of an opponent's choice.	5	5
Demonic Tutor	{1}{B}		Sorcery		Search your library for a card and put that card into your hand. Then shuffle your library.		
Dingus Egg	{4}		Artifact		Whenever a land is put into a graveyard from the battlefield, Dingus Egg deals 2 damage to that land's controller.		
Disenchant	{1}{W}		Instant		Destroy target artifact or enchantment.		
Disintegrate	{X}{R}		Sorcery		Disintegrate deals X damage to target creature or player. That creature can't be regenerated this turn. If the creature would die this turn, exile it instead.		
Disrupting Scepter	{3}		Artifact		{3}, {T}: Target player discards a card. Activate this ability only during your turn.		
Dragon Whelp	{2}{R}{R}		Creature	Dragon	Flying|{R}: Dragon Whelp gets +1/+0 until end of turn. If this ability has been activated four or more times this turn, sacrifice Dragon Whelp at the beginning of the next end step.	2	3
Drain Life	{X}{1}{B}		Sorcery		Spend only black mana on X.|Drain Life deals X damage to target creature or player. You gain life equal to the damage dealt, but not more life than the player's life total before Drain Life dealt damage or the creature's toughness.		
Drain Power	{U}{U}		Sorcery		Target player activates a mana ability of each land he or she controls. Then put all mana from that player's mana pool into yours.		
Drudge Skeletons	{1}{B}		Creature	Skeleton	{B}: Regenerate Drudge Skeletons. (The next time this creature would be destroyed this turn, it isn't. Instead tap it, remove all damage from it, and remove it from combat.)	1	1
Dwarven Demolition Team	{2}{R}		Creature	Dwarf	{T}: Destroy target Wall.	1	1
Dwarven Warriors	{2}{R}		Creature	Dwarf,Warrior	{T}: Target creature with power 2 or less can't be blocked this turn.	1	1
Earth Elemental	{3}{R}{R}		Creature	Elemental		4	5
Earthbind	{R}		Enchantment	Aura	Enchant creature|When Earthbind enters the battlefield, if enchanted creature has flying, Earthbind deals 2 damage to that creature and Earthbind gains 'Enchanted creature loses flying.'		
Earthquake	{X}{R}		Sorcery		Earthquake deals X damage to each creature without flying and each player.		
Elvish Archers	{1}{G}		Creature	Elf,Archer	First strike	2	1
Evil Presence	{B}		Enchantment	Aura	Enchant land|Enchanted land is a Swamp.		
False Orders	{R}		Instant		Cast False Orders only during the declare blockers step.|Remove target creature defending player controls from combat. Creatures it was blocking that had become blocked by only that creature this combat become unblocked. You may have it block an attacking creature of your choice.		
Farmstead	{W}{W}{W}		Enchantment	Aura	Enchant land|Enchanted land has 'At the beginning of your upkeep, you may pay {W}{W}. If you do, you gain 1 life.'		
Fastbond	{G}		Enchantment		You may play any number of additional lands on each of your turns.|Whenever you play a land, if it wasn't the first land you played this turn, Fastbond deals 1 damage to you.		
Fear	{B}{B}		Enchantment	Aura	Enchant creature (Target a creature as you cast this. This card enters the battlefield attached to that creature.)|Enchanted creature has fear. (It can't be blocked except by artifact creatures and/or black creatures.)		
Feedback	{2}{U}		Enchantment	Aura	Enchant enchantment|At the beginning of the upkeep of enchanted enchantment's controller, Feedback deals 1 damage to that player.		
Fire Elemental	{3}{R}{R}		Creature	Elemental		5	4
Fireball	{X}{R}		Sorcery		Fireball deals X damage divided evenly, rounded down, among any number of target creatures and/or players.|Fireball costs {1} more to cast for each target beyond the first.		
Firebreathing	{R}		Enchantment	Aura	Enchant creature|{R}: Enchanted creature gets +1/+0 until end of turn.		
Flashfires	{3}{R}		Sorcery		Destroy all Plains.		
Flight	{U}		Enchantment	Aura	Enchant creature|Enchanted creature has flying.		
Fog	{G}		Instant		Prevent all combat damage that would be dealt this turn.		
Force of Nature	{2}{G}{G}{G}{G}		Creature	Elemental	Trample (If this creature would assign enough damage to its blockers to destroy them, you may have it assign the rest of its damage to defending player or planeswalker.)|At the beginning of your upkeep, Force of Nature deals 8 damage to you unless you pay {G}{G}{G}{G}.	8	8
Forcefield	{3}		Artifact		{1}: The next time an unblocked creature of your choice would deal combat damage to you this turn, prevent all but 1 of that damage.		
Forest		Basic	Land	Forest	G		
Fork	{R}{R}		Instant		Copy target instant or sorcery spell, except that the copy is red. You may choose new targets for the copy.		
Frozen Shade	{2}{B}		Creature	Shade	{B}: Frozen Shade gets +1/+1 until end of turn.	0	1
Fungusaur	{3}{G}		Creature	Fungus,Lizard	Whenever Fungusaur is dealt damage, put a +1/+1 counter on it.	2	2
Gaea's Liege	{3}{G}{G}{G}		Creature	Avatar	As long as Gaea's Liege isn't attacking, its power and toughness are each equal to the number of Forests you control. As long as Gaea's Liege is attacking, its power and toughness are each equal to the number of Forests defending player controls.|{T}: Target land becomes a Forest until Gaea's Liege leaves the battlefield.	*	*
Gauntlet of Might	{4}		Artifact		Red creatures get +1/+1.|Whenever a Mountain is tapped for mana, its controller adds {R} to his or her mana pool (in addition to the mana the land produces).		
Giant Growth	{G}		Instant		Target creature gets +3/+3 until end of turn.		
Giant Spider	{3}{G}		Creature	Spider	Reach (This creature can block creatures with flying.)	2	4
Glasses of Urza	{1}		Artifact		{T}: Look at target player's hand.		
Gloom	{2}{B}		Enchantment		White spells cost {3} more to cast.|Activated abilities of white enchantments cost {3} more to activate.		
Goblin Balloon Brigade	{R}		Creature	Goblin,Warrior	{R}: Goblin Balloon Brigade gains flying until end of turn.	1	1
Goblin King	{1}{R}{R}		Creature	Goblin	Other Goblin creatures get +1/+1 and have mountainwalk. (They can't be blocked as long as defending player controls a Mountain.)	2	2
Granite Gargoyle	{2}{R}		Creature	Gargoyle	Flying|{R}: Granite Gargoyle gets +0/+1 until end of turn.	2	2
Gray Ogre	{2}{R}		Creature	Ogre		2	2
Green Ward	{W}		Enchantment	Aura	Enchant creature|Enchanted creature has protection from green. This effect doesn't remove Green Ward.		
Grizzly Bears	{1}{G}		Creature	Bear		2	2
Guardian Angel	{X}{W}		Instant		Prevent the next X damage that would be dealt to target creature or player this turn. Until end of turn, you may pay {1} any time you could cast an instant. If you do, prevent the next 1 damage that would be dealt to that creature or player this turn.		
Healing Salve	{W}		Instant		Choose one - Target player gains 3 life; or prevent the next 3 damage that would be dealt to target creature or player this turn.		
Helm of Chatzuk	{1}		Artifact		{1}, {T}: Target creature gains banding until end of turn. (Any creatures with banding, and up to one without, can attack in a band. Bands are blocked as a group. If any creatures with banding a player controls are blocking or being blocked by a creature, that player divides that creature's combat damage, not its controller, among any of the creatures it's being blocked by or is blocking.)		
Hill Giant	{3}{R}		Creature	Giant		3	3
Holy Armor	{W}		Enchantment	Aura	Enchant creature|Enchanted creature gets +0/+2.|{W}: Enchanted creature gets +0/+1 until end of turn.		
Holy Strength	{W}		Enchantment	Aura	Enchant creature|Enchanted creature gets +1/+2.		
Howl from Beyond	{X}{B}		Instant		Target creature gets +X/+0 until end of turn.		
Howling Mine	{2}		Artifact		At the beginning of each player's draw step, if Howling Mine is untapped, that player draws an additional card.		
Hurloon Minotaur	{1}{R}{R}		Creature	Minotaur		2	3
Hurricane	{X}{G}		Sorcery		Hurricane deals X damage to each creature with flying and each player.		
Hypnotic Specter	{1}{B}{B}		Creature	Specter	Flying|Whenever Hypnotic Specter deals damage to an opponent, that player discards a card at random.	2	2
Ice Storm	{2}{G}		Sorcery		Destroy target land.		
Icy Manipulator	{4}		Artifact		{1}, {T}: Tap target artifact, creature, or land.		
Illusionary Mask	{2}		Artifact		{X}: You may choose a creature card in your hand whose mana cost could be paid by some amount of, or all of, the mana you spent on {X}. If you do, you may cast that card face down as a 2/2 creature spell without paying its mana cost. If the creature that spell becomes as it resolves has not been turned face up and would assign or deal damage, be dealt damage, or become tapped, instead it's turned face up and assigns or deals damage, is dealt damage, or becomes tapped. Activate this ability only any time you could cast a sorcery.		
Instill Energy	{G}		Enchantment	Aura	Enchant creature|Enchanted creature can attack as though it had haste.|{0}: Untap enchanted creature. Activate this ability only during your turn and only once each turn.		
Invisibility	{U}{U}		Enchantment	Aura	Enchant creature|Enchanted creature can't be blocked except by Walls.		
Iron Star	{1}		Artifact		Whenever a player casts a red spell, you may pay {1}. If you do, you gain 1 life.		
Ironclaw Orcs	{1}{R}		Creature	Orc	Ironclaw Orcs can't block creatures with power 2 or greater.	2	2
Ironroot Treefolk	{4}{G}		Creature	Treefolk		3	5
Island		Basic	Land	Island	U		
Island Sanctuary	{1}{W}		Enchantment		If you would draw a card during your draw step, instead you may skip that draw. If you do, until your next turn, you can't be attacked except by creatures with flying and/or islandwalk.		
Ivory Cup	{1}		Artifact		Whenever a player casts a white spell, you may pay {1}. If you do, you gain 1 life.		
Jade Monolith	{4}		Artifact		{1}: The next time a source of your choice would deal damage to target creature this turn, that source deals that damage to you instead.		
Jade Statue	{4}		Artifact		{2}: Jade Statue becomes a 3/6 Golem artifact creature until end of combat. Activate this ability only during combat.		
Jayemdae Tome	{4}		Artifact		{4}, {T}: Draw a card.		
Juggernaut	{4}		Artifact,Creature	Juggernaut	Juggernaut attacks each turn if able.|Juggernaut can't be blocked by Walls.	5	3
Jump	{U}		Instant		Target creature gains flying until end of turn.		
Karma	{2}{W}{W}		Enchantment		At the beginning of each player's upkeep, Karma deals damage to that player equal to the number of Swamps he or she controls.		
Keldon Warlord	{2}{R}{R}		Creature	Human,Barbarian	Keldon Warlord's power and toughness are each equal to the number of non-Wall creatures you control.	*	*
Kormus Bell	{4}		Artifact		All Swamps are 1/1 black creatures that are still lands.		
Kudzu	{1}{G}{G}		Enchantment	Aura	Enchant land|When enchanted land becomes tapped, destroy it. That land's controller attaches Kudzu to a land of his or her choice.		
Lance	{W}		Enchantment	Aura	Enchant creature|Enchanted creature has first strike.		
Ley Druid	{2}{G}		Creature	Human,Druid	{T}: Untap target land.	1	1
Library of Leng	{1}		Artifact		You have no maximum hand size.|If an effect causes you to discard a card, discard it, but you may put it on top of your library instead of into your graveyard.		
Lich	{B}{B}{B}{B}		Enchantment		As Lich enters the battlefield, you lose life equal to your life total.|You don't lose the game for having 0 or less life.|If you would gain life, draw that many cards instead.|Whenever you're dealt damage, sacrifice that many nontoken permanents. If you can't, you lose the game.|When Lich is put into a graveyard from the battlefield, you lose the game.		
Lifeforce	{G}{G}		Enchantment		{G}{G}: Counter target black spell.		
Lifelace	{G}		Instant		Target spell or permanent becomes green. (Mana symbols on that permanent remain unchanged.)		
Lifetap	{U}{U}		Enchantment		Whenever a Forest an opponent controls becomes tapped, you gain 1 life.		
Lightning Bolt	{R}		Instant		Lightning Bolt deals 3 damage to target creature or player.		
Living Artifact	{G}		Enchantment	Aura	Enchant artifact|Whenever you're dealt damage, put that many vitality counters on Living Artifact.|At the beginning of your upkeep, you may remove a vitality counter from Living Artifact. If you do, you gain 1 life.		
Living Lands	{3}{G}		Enchantment		All Forests are 1/1 creatures that are still lands.		
Living Wall	{4}		Artifact,Creature	Wall	Defender (This creature can't attack.)|{1}: Regenerate Living Wall.	0	6
Llanowar Elves	{G}		Creature	Elf,Druid	{T}: Add {G} to your mana pool.	1	1
Lord of Atlantis	{U}{U}		Creature	Merfolk	Other Merfolk creatures get +1/+1 and have islandwalk.	2	2
Lord of the Pit	{4}{B}{B}{B}		Creature	Demon	Flying, trample|At the beginning of your upkeep, sacrifice a creature other than Lord of the Pit. If you can't, Lord of the Pit deals 7 damage to you.	7	7
Lure	{1}{G}{G}		Enchantment	Aura	Enchant creature|All creatures able to block enchanted creature do so.		
Magical Hack	{U}		Instant		Change the text of target spell or permanent by replacing all instances of one basic land type with another. (For example, you may change 'swampwalk' to 'plainswalk.' This effect lasts indefinitely.)		
Mahamoti Djinn	{4}{U}{U}		Creature	Djinn	Flying (This creature can't be blocked except by creatures with flying or reach.)	5	6
Mana Flare	{2}{R}		Enchantment		Whenever a player taps a land for mana, that player adds one mana to his or her mana pool of any type that land produced.		
Mana Short	{2}{U}		Instant		Tap all lands target player controls and empty his or her mana pool.		
Mana Vault	{1}		Artifact		Mana Vault doesn't untap during your untap step.|At the beginning of your upkeep, you may pay {4}. If you do, untap Mana Vault.|At the beginning of your draw step, if Mana Vault is tapped, it deals 1 damage to you.|{T}: Add {3} to your mana pool.		
Manabarbs	{3}{R}		Enchantment		Whenever a player taps a land for mana, Manabarbs deals 1 damage to that player.		
Meekstone	{1}		Artifact		Creatures with power 3 or greater don't untap during their controllers' untap steps.		
Merfolk of the Pearl Trident	{U}		Creature	Merfolk		1	1
Mesa Pegasus	{1}{W}		Creature	Pegasus	Flying; banding (Any creatures with banding, and up to one without, can attack in a band. Bands are blocked as a group. If any creatures with banding you control are blocking or being blocked by a creature, you divide that creature's combat damage, not its controller, among any of the creatures it's being blocked by or is blocking.)	1	1
Mind Twist	{X}{B}		Sorcery		Target player discards X cards at random.		
Mons's Goblin Raiders	{R}		Creature	Goblin		1	1
Mountain		Basic	Land	Mountain	R		
Mox Emerald	{0}		Artifact		{T}: Add {G} to your mana pool.		
Mox Jet	{0}		Artifact		{T}: Add {B} to your mana pool.		
Mox Pearl	{0}		Artifact		{T}: Add {W} to your mana pool.		
Mox Ruby	{0}		Artifact		{T}: Add {R} to your mana pool.		
Mox Sapphire	{0}		Artifact		{T}: Add {U} to your mana pool.		
Natural Selection	{G}		Instant		Look at the top three cards of target player's library, then put them back in any order. You may have that player shuffle his or her library.		
Nether Shadow	{B}{B}		Creature	Spirit	Haste|At the beginning of your upkeep, if Nether Shadow is in your graveyard with three or more creature cards above it, you may put Nether Shadow onto the battlefield.	1	1
Nettling Imp	{2}{B}		Creature	Imp	{T}: Choose target non-Wall creature the active player has controlled continuously since the beginning of the turn. That creature attacks this turn if able. If it doesn't, destroy it at the beginning of the next end step. Activate this ability only during an opponent's turn, before attackers are declared.	1	1
Nevinyrral's Disk	{4}		Artifact		Nevinyrral's Disk enters the battlefield tapped.|{1}, {T}: Destroy all artifacts, creatures, and enchantments.		
Nightmare	{5}{B}		Creature	Nightmare,Horse	Flying|Nightmare's power and toughness are each equal to the number of Swamps you control.	*	*
