Name	ManaCost	SuperType	Types	SubTypes	Text	Power	Toughness
Rites of Flourishing	{2}{G}		Enchantment		At the beginning of each player's draw step, that player draws an additional card.|Each player may play an additional land on each of his or her turns.		
Roc Egg	{2}{W}		Creature	Bird	Defender (This creature can't attack.)|When Roc Egg dies, put a 3/3 white Bird creature token with flying onto the battlefield.	0	3
Rootbound Crag			Land		Rootbound Crag enters the battlefield tapped unless you control a Mountain or a Forest.|{T}: Add {R} or {G} to your mana pool.		
Royal Assassin	{1}{B}{B}		Creature	Human,Assassin	{T}: Destroy target tapped creature.	1	1
Runeclaw Bear	{1}{G}		Creature	Bear		2	2
Rune-Scarred Demon	{5}{B}{B}		Creature	Demon	Flying|When Rune-Scarred Demon enters the battlefield, search your library for a card, put it into your hand, then shuffle your library.	6	6
Rusted Sentinel	{4}		Artifact,Creature	Golem	Rusted Sentinel enters the battlefield tapped.	3	4
Sacred Wolf	{2}{G}		Creature	Wolf	Hexproof (This creature can't be the target of spells or abilities your opponents control.)	3	1
Scepter of Empires	{3}		Artifact		{T}: Scepter of Empires deals 1 damage to target player. It deals 3 damage to that player instead if you control artifacts named Crown of Empires and Throne of Empires.		
Scrambleverse	{6}{R}{R}		Sorcery		For each nonland permanent, choose a player at random. Then each player gains control of each permanent for which he or she was chosen. Untap those permanents.		
Sengir Vampire	{3}{B}{B}		Creature	Vampire	Flying|Whenever a creature dealt damage by Sengir Vampire this turn dies, put a +1/+1 counter on Sengir Vampire.	4	4
Serra Angel	{3}{W}{W}		Creature	Angel	Flying|Vigilance (Attacking doesn't cause this creature to tap.)	4	4
Shock	{R}		Instant		Shock deals 2 damage to target creature or player.		
Siege Mastodon	{4}{W}		Creature	Elephant		3	5
Skinshifter	{1}{G}		Creature	Human,Shaman	{G}: Choose one - Until end of turn, Skinshifter becomes a 4/4 Rhino and gains trample; or until end of turn, Skinshifter becomes a 2/2 Bird and gains flying; or until end of turn, Skinshifter becomes a 0/8 Plant. Activate this ability only once each turn.	1	1
Skywinder Drake	{2}{U}		Creature	Drake	Flying|Skywinder Drake can block only creatures with flying.	3	1
Slaughter Cry	{2}{R}		Instant		Target creature gets +3/+0 and gains first strike until end of turn. (It deals combat damage before creatures without first strike.)		
Smallpox	{B}{B}		Sorcery		Each player loses 1 life, discards a card, sacrifices a creature, then sacrifices a land.		
Solemn Simulacrum	{4}		Artifact,Creature	Golem	When Solemn Simulacrum enters the battlefield, you may search your library for a basic land card, put that card onto the battlefield tapped, then shuffle your library.|When Solemn Simulacrum dies, you may draw a card.	2	2
Sorin Markov	{3}{B}{B}{B}		Planeswalker	Sorin	+2: Sorin Markov deals 2 damage to target creature or player and you gain 2 life.|-3: Target opponent's life total becomes 10.|-7: You control target player during that player's next turn.		
Sorin's Thirst	{B}{B}		Instant		Sorin's Thirst deals 2 damage to target creature and you gain 2 life.		
Sorin's Vengeance	{4}{B}{B}{B}		Sorcery		Sorin's Vengeance deals 10 damage to target player and you gain 10 life.		
Sphinx of Uthuun	{5}{U}{U}		Creature	Sphinx	Flying|When Sphinx of Uthuun enters the battlefield, reveal the top five cards of your library. An opponent separates those cards into two piles. Put one pile into your hand and the other into your graveyard.	5	6
Spirit Mantle	{1}{W}		Enchantment	Aura	Enchant creature|Enchanted creature gets +1/+1 and has protection from creatures.		
Stampeding Rhino	{4}{G}		Creature	Rhino	Trample (If this creature would assign enough damage to its blockers to destroy them, you may have it assign the rest of its damage to defending player or planeswalker.)	4	4
Stave Off	{W}		Instant		Target creature gains protection from the color of your choice until end of turn. (It can't be blocked, targeted, dealt damage, or enchanted by anything of that color.)		
Stingerfling Spider	{4}{G}		Creature	Spider	Reach (This creature can block creatures with flying.)|When Stingerfling Spider enters the battlefield, you may destroy target creature with flying.	2	5
Stonehorn Dignitary	{3}{W}		Creature	Rhino,Soldier	When Stonehorn Dignitary enters the battlefield, target opponent skips his or her next combat phase.	1	4
Stormblood Berserker	{1}{R}		Creature	Human,Berserker	Bloodthirst 2 (If an opponent was dealt damage this turn, this creature enters the battlefield with two +1/+1 counters on it.)|Stormblood Berserker can't be blocked except by two or more creatures.	1	1
Stormfront Pegasus	{1}{W}		Creature	Pegasus	Flying	2	1
Sun Titan	{4}{W}{W}		Creature	Giant	Vigilance|Whenever Sun Titan enters the battlefield or attacks, you may return target permanent card with converted mana cost 3 or less from your graveyard to the battlefield.	6	6
Sundial of the Infinite	{2}		Artifact		{1}, {T}: End the turn. Activate this ability only during your turn. (Exile all spells and abilities on the stack. Discard down to your maximum hand size. Damage wears off, and 'this turn' and 'until end of turn' effects end.)		
Sunpetal Grove			Land		Sunpetal Grove enters the battlefield tapped unless you control a Forest or a Plains.|{T}: Add {G} or {W} to your mana pool.		
Sutured Ghoul	{4}{B}{B}{B}		Creature	Zombie	Trample|As Sutured Ghoul enters the battlefield, exile any number of creature cards from your graveyard.|Sutured Ghoul's power is equal to the total power of the exiled cards and its toughness is equal to their total toughness.	*	*
Swamp		Basic	Land	Swamp	B		
Swiftfoot Boots	{2}		Artifact	Equipment	Equipped creature has hexproof and haste.|Equip {1}		
Taste of Blood	{B}		Sorcery		Taste of Blood deals 1 damage to target player and you gain 1 life.		
Tectonic Rift	{3}{R}		Sorcery		Destroy target land. Creatures without flying can't block this turn.		
Thran Golem	{5}		Artifact,Creature	Golem	As long as Thran Golem is enchanted, it gets +2/+2 and has flying, first strike, and trample.	3	3
Throne of Empires	{4}		Artifact		{1}, {T}: Put a 1/1 white Soldier creature token onto the battlefield. Put five of those tokens onto the battlefield instead if you control artifacts named Crown of Empires and Scepter of Empires.		
Time Reversal	{3}{U}{U}		Sorcery		Each player shuffles his or her hand and graveyard into his or her library, then draws seven cards. Exile Time Reversal.		
Timely Reinforcements	{2}{W}		Sorcery		If you have less life than an opponent, you gain 6 life. If you control fewer creatures than an opponent, put three 1/1 white Soldier creature tokens onto the battlefield.		
Titanic Growth	{1}{G}		Instant		Target creature gets +4/+4 until end of turn.		
Tormented Soul	{B}		Creature	Spirit	Tormented Soul can't block and can't be blocked.	1	1
Trollhide	{2}{G}		Enchantment	Aura	Enchant creature|Enchanted creature gets +2/+2 and has '{1}{G}: Regenerate this creature.' (The next time the creature would be destroyed this turn, it isn't. Instead tap it, remove all damage from it, and remove it from combat.)		
Turn to Frog	{1}{U}		Instant		Target creature loses all abilities and becomes a 1/1 blue Frog until end of turn.		
Unsummon	{U}		Instant		Return target creature to its owner's hand.		
Vampire Outcasts	{2}{B}{B}		Creature	Vampire	Bloodthirst 2 (If an opponent was dealt damage this turn, this creature enters the battlefield with two +1/+1 counters on it.)|Lifelink (Damage dealt by this creature also causes you to gain that much life.)	2	2
Vastwood Gorger	{5}{G}		Creature	Wurm		5	6
Vengeful Pharaoh	{2}{B}{B}{B}		Creature	Zombie	Deathtouch (Any amount of damage this deals to a creature is enough to destroy it.)|Whenever combat damage is dealt to you or a planeswalker you control, if Vengeful Pharaoh is in your graveyard, destroy target attacking creature, then put Vengeful Pharaoh on top of your library.	5	4
Visions of Beyond	{U}		Instant		Draw a card. If a graveyard has twenty or more cards in it, draw three cards instead.		
Volcanic Dragon	{4}{R}{R}		Creature	Dragon	Flying|Haste (This creature can attack and {T} as soon as it comes under your control.)	4	4
Wall of Torches	{1}{R}		Creature	Wall	Defender (This creature can't attack.)	4	1
Warpath Ghoul	{2}{B}		Creature	Zombie		3	2
Warstorm Surge	{5}{R}		Enchantment		Whenever a creature enters the battlefield under your control, it deals damage equal to its power to target creature or player.		
Worldslayer	{5}		Artifact	Equipment	Whenever equipped creature deals combat damage to a player, destroy all permanents other than Worldslayer.|Equip {5} ({5}: Attach to target creature you control. Equip only as a sorcery.)		
Wring Flesh	{B}		Instant		Target creature gets -3/-1 until end of turn.		
Wurm's Tooth	{2}		Artifact		Whenever a player casts a green spell, you may gain 1 life.		
Zombie Goliath	{4}{B}		Creature	Zombie,Giant		4	3
Zombie Infestation	{1}{B}		Enchantment		Discard two cards: Put a 2/2 black Zombie creature token onto the battlefield.		
