Name	ManaCost	SuperType	Types	SubTypes	Text	Power	Toughness
Sol Grail	{3}		Artifact		As Sol Grail enters the battlefield, choose a color.|{T}: Add one mana of the chosen color to your mana pool.		
Sorrow's Path			Land		{T}: Choose two target blocking creatures an opponent controls. If each of those creatures could block all creatures that the other is blocking, remove both of them from combat. Each one then blocks all creatures the other was blocking.|Whenever Sorrow's Path becomes tapped, it deals 2 damage to you and each creature you control.		
Spectral Shield	{1}{W}{U}		Enchantment	Aura	Enchant creature|Enchanted creature gets +0/+2 and can't be the target of spells.		
Spiny Starfish	{2}{U}		Creature	Starfish	{U}: Regenerate Spiny Starfish.|At the beginning of each end step, if Spiny Starfish regenerated this turn, put a 0/1 blue Starfish creature token onto the battlefield for each time it regenerated this turn.	0	1
Spirit Shackle	{B}{B}		Enchantment	Aura	Enchant creature|Whenever enchanted creature becomes tapped, put a -0/-2 counter on it.		
Spoils of Victory	{2}{G}		Sorcery		Search your library for a Plains, Island, Swamp, Mountain, or Forest card and put that card onto the battlefield. Then shuffle your library.		
Stangg	{4}{R}{G}	Legendary	Creature	Human,Warrior	When Stangg enters the battlefield, put a legendary 3/4 red and green Human Warrior creature token named Stangg Twin onto the battlefield. When Stangg leaves the battlefield, exile that token. When that token leaves the battlefield, sacrifice Stangg.	3	4
Stolen Grain	{4}{B}{B}		Sorcery		Stolen Grain deals 5 damage to target opponent. You gain 5 life.		
Storm World	{R}	World	Enchantment		At the beginning of each player's upkeep, Storm World deals X damage to that player, where X is 4 minus the number of cards in his or her hand.		
Strategic Planning	{1}{U}		Sorcery		Look at the top three cards of your library. Put one of them into your hand and the rest into your graveyard.		
Sun Ce, Young Conquerer	{3}{U}{U}	Legendary	Creature	Human,Soldier	Horsemanship (This creature can't be blocked except by creatures with horsemanship.)|When Sun Ce, Young Conquerer enters the battlefield, you may return target creature to its owner's hand.	3	3
Sun Quan, Lord of Wu	{4}{U}{U}	Legendary	Creature	Human,Soldier	Creatures you control have horsemanship. (They can't be blocked except by creatures with horsemanship.)	4	4
Sunastian Falconer	{3}{R}{G}	Legendary	Creature	Human,Shaman	{T}: Add {2} to your mana pool.	4	4
Swamp		Basic	Land	Swamp	B		
Sword of the Ages	{6}		Artifact		Sword of the Ages enters the battlefield tapped.|{T}, Sacrifice Sword of the Ages and any number of creatures you control: Sword of the Ages deals X damage to target creature or player, where X is the total power of the creatures sacrificed this way, then exile Sword of the Ages and those creature cards.		
Takklemaggot	{2}{B}{B}		Enchantment	Aura	Enchant creature|At the beginning of the upkeep of enchanted creature's controller, put a -0/-1 counter on that creature.|When enchanted creature dies, that creature's controller chooses a creature that Takklemaggot could enchant. If he or she does, return Takklemaggot to the battlefield under your control attached to that creature. If he or she doesn't, return Takklemaggot to the battlefield under your control as a non-Aura enchantment. It loses 'enchant creature' and gains 'At the beginning of that player's upkeep, Takklemaggot deals 1 damage to him or her.'		
Tetsuo Umezawa	{U}{B}{R}	Legendary	Creature	Human,Archer	Tetsuo Umezawa can't be the target of Aura spells.|{U}{B}{B}{R}, {T}: Destroy target tapped or blocking creature.	3	3
The Abyss	{3}{B}	World	Enchantment		At the beginning of each player's upkeep, destroy target nonartifact creature that player controls of his or her choice. It can't be regenerated.		
The Lady of the Mountain	{4}{R}{G}	Legendary	Creature	Giant		5	5
The Tabernacle at Pendrell Vale		Legendary	Land		All creatures have 'At the beginning of your upkeep, destroy this creature unless you pay {1}.'		
The Wretched	{3}{B}{B}		Creature	Demon	At end of combat, gain control of all creatures blocking The Wretched for as long as you control The Wretched.	2	5
Three Visits	{1}{G}		Sorcery		Search your library for a Forest card and put that card onto the battlefield. Then shuffle your library.		
Tobias Andrion	{3}{W}{U}	Legendary	Creature	Human,Advisor		4	4
Tor Wauki	{2}{B}{B}{R}	Legendary	Creature	Human,Archer	{T}: Tor Wauki deals 2 damage to target attacking or blocking creature.	3	3
Torsten Von Ursus	{3}{G}{G}{W}	Legendary	Creature	Human,Soldier		5	5
Tracker	{2}{G}		Creature	Human	{G}{G}, {T}: Tracker deals damage equal to its power to target creature. That creature deals damage equal to its power to Tracker.	2	2
Trip Wire	{2}{G}		Sorcery		Destroy target creature with horsemanship.		
Tropical Island			Land	Forest,Island			
Tuknir Deathlock	{R}{R}{G}{G}	Legendary	Creature	Human,Wizard	Flying|{R}{G}, {T}: Target creature gets +2/+2 until end of turn.	2	2
Urborg		Legendary	Land		{T}: Add {B} to your mana pool.|{T}: Target creature loses first strike or swampwalk until end of turn.		
Vaevictis Asmadi	{2}{B}{B}{R}{R}{G}{G}	Legendary	Creature	Elder,Dragon	Flying|At the beginning of your upkeep, sacrifice Vaevictis Asmadi unless you pay {B}{R}{G}.|{B}: Vaevictis Asmadi gets +1/+0 until end of turn.|{R}: Vaevictis Asmadi gets +1/+0 until end of turn.|{G}: Vaevictis Asmadi gets +1/+0 until end of turn.	7	7
Volcanic Island			Land	Island,Mountain			
Voodoo Doll	{6}		Artifact		At the beginning of your upkeep, put a pin counter on Voodoo Doll.|At the beginning of your end step, if Voodoo Doll is untapped, destroy Voodoo Doll and it deals damage to you equal to the number of pin counters on it.|{X}{X}, {T}: Voodoo Doll deals damage equal to the number of pin counters on it to target creature or player. X is the number of pin counters on Voodoo Doll.		
Wall of Light	{2}{W}		Creature	Wall	Defender (This creature can't attack.)|Protection from black	1	5
Wandering Mage	{W}{U}{B}		Creature	Human,Cleric,Wizard	{W}, Pay 1 life: Prevent the next 2 damage that would be dealt to target creature this turn.|{U}: Prevent the next 1 damage that would be dealt to target Cleric or Wizard creature this turn.|{B}, Put a -1/-1 counter on a creature you control: Prevent the next 2 damage that would be dealt to target player this turn.	0	3
Wei Elite Companions	{4}{B}		Creature	Human,Soldier	Horsemanship (This creature can't be blocked except by creatures with horsemanship.)	3	3
Wei Infantry	{1}{B}		Creature	Human,Soldier		2	1
Wei Night Raiders	{2}{B}{B}		Creature	Human,Soldier	Horsemanship (This creature can't be blocked except by creatures with horsemanship.)|Whenever Wei Night Raiders deals damage to an opponent, that player discards a card.	2	2
Wei Strike Force	{2}{B}		Creature	Human,Soldier	Horsemanship (This creature can't be blocked except by creatures with horsemanship.)	2	1
Willow Priestess	{2}{G}{G}		Creature	Faerie,Druid	{T}: You may put a Faerie permanent card from your hand onto the battlefield.|{2}{G}: Target green creature gains protection from black until end of turn.	2	2
Willow Satyr	{2}{G}{G}		Creature	Satyr	You may choose not to untap Willow Satyr during your untap step.|{T}: Gain control of target legendary creature for as long as you control Willow Satyr and Willow Satyr remains tapped.	1	1
Wormwood Treefolk	{3}{G}{G}		Creature	Treefolk	{G}{G}: Wormwood Treefolk gains forestwalk until end of turn and deals 2 damage to you.|{B}{B}: Wormwood Treefolk gains swampwalk until end of turn and deals 2 damage to you.	4	4
Wu Elite Cavalry	{3}{U}		Creature	Human,Soldier	Horsemanship (This creature can't be blocked except by creatures with horsemanship.)	2	3
Wu Longbowman	{2}{U}		Creature	Human,Soldier,Archer	{T}: Wu Longbowman deals 1 damage to target creature or player. Activate this ability only during your turn, before attackers are declared.	1	1
Wu Warship	{2}{U}		Creature	Human,Soldier	Wu Warship can't attack unless defending player controls an Island.	3	3
Xiahou Dun, the One-Eyed	{2}{B}{B}	Legendary	Creature	Human,Soldier	Horsemanship (This creature can't be blocked except by creatures with horsemanship.)|Sacrifice Xiahou Dun, the One-Eyed: Return target black card from your graveyard to your hand. Activate this ability only during your turn, before attackers are declared.	3	2
Xira Arien	{B}{R}{G}	Legendary	Creature	Insect,Wizard	Flying|{B}{R}{G}, {T}: Target player draws a card.	1	2
Young Wei Recruits	{1}{B}		Creature	Human,Soldier	Young Wei Recruits can't block.	2	2
Zhang Fei, Fierce Warrior	{4}{W}{W}	Legendary	Creature	Human,Soldier,Warrior	Vigilance; horsemanship (This creature can't be blocked except by creatures with horsemanship.)	4	4
Zodiac Dragon	{7}{R}{R}		Creature	Dragon	When Zodiac Dragon is put into your graveyard from the battlefield, you may return it to your hand.	8	8
