Name	ManaCost	SuperType	Types	SubTypes	Text	Power	Toughness
Thunder of Hooves	{3}{R}		Sorcery		Thunder of Hooves deals X damage to each creature without flying and each player, where X is the number of Beasts on the battlefield.		
Towering Baloth	{6}{G}{G}		Creature	Beast	Morph {6}{G} (You may cast this face down as a 2/2 creature for {3}. Turn it face up any time for its morph cost.)	7	6
Trade Secrets	{1}{U}{U}		Sorcery		Target opponent draws two cards, then you draw up to four cards. That opponent may repeat this process as many times as he or she chooses.		
Tranquil Thicket			Land		Tranquil Thicket enters the battlefield tapped.|{T}: Add {G} to your mana pool.|Cycling {G} ({G}, Discard this card: Draw a card.)		
Treespring Lorian	{5}{G}		Creature	Beast	Morph {5}{G} (You may cast this face down as a 2/2 creature for {3}. Turn it face up any time for its morph cost.)	5	4
Tribal Golem	{6}		Artifact,Creature	Golem	Tribal Golem has trample as long as you control a Beast, haste as long as you control a Goblin, first strike as long as you control a Soldier, flying as long as you control a Wizard, and '{B}: Regenerate Tribal Golem' as long as you control a Zombie.	4	4
Tribal Unity	{X}{2}{G}		Instant		Creatures of the creature type of your choice get +X/+X until end of turn.		
Trickery Charm	{U}		Instant		Choose one - Target creature gains flying until end of turn; or target creature becomes the creature type of your choice until end of turn; or look at the top four cards of your library, then put them back in any order.		
True Believer	{W}{W}		Creature	Human,Cleric	You have shroud. (You can't be the target of spells or abilities.)	2	2
Undead Gladiator	{1}{B}{B}		Creature	Zombie,Barbarian	{1}{B}, Discard a card: Return Undead Gladiator from your graveyard to your hand. Activate this ability only during your upkeep.|Cycling {1}{B} ({1}{B}, Discard this card: Draw a card.)	3	1
Unholy Grotto			Land		{T}: Add {1} to your mana pool.|{B}, {T}: Put target Zombie card from your graveyard on top of your library.		
Unified Strike	{W}		Instant		Exile target attacking creature if its power is less than or equal to the number of Soldiers on the battlefield.		
Venomspout Brackus	{6}{G}		Creature	Beast	{1}{G}, {T}: Venomspout Brackus deals 5 damage to target attacking or blocking creature with flying.|Morph {3}{G}{G} (You may cast this face down as a 2/2 creature for {3}. Turn it face up any time for its morph cost.)	5	5
Visara the Dreadful	{3}{B}{B}{B}	Legendary	Creature	Gorgon	Flying|{T}: Destroy target creature. It can't be regenerated.	5	5
Vitality Charm	{G}		Instant		Choose one - Put a 1/1 green Insect creature token onto the battlefield; or target creature gets +1/+1 and gains trample until end of turn; or regenerate target Beast.		
Voice of the Woods	{3}{G}{G}		Creature	Elf	Tap five untapped Elves you control: Put a 7/7 green Elemental creature token with trample onto the battlefield.	2	2
Voidmage Prodigy	{U}{U}		Creature	Human,Wizard	{U}{U}, Sacrifice a Wizard: Counter target spell.|Morph {U} (You may cast this face down as a 2/2 creature for {3}. Turn it face up any time for its morph cost.)	2	1
Walking Desecration	{2}{B}		Creature	Zombie	{B}, {T}: Creatures of the creature type of your choice attack this turn if able.	1	1
Wall of Mulch	{1}{G}		Creature	Wall	Defender (This creature can't attack.)|{G}, Sacrifice a Wall: Draw a card.	0	4
Wave of Indifference	{X}{R}		Sorcery		X target creatures can't block this turn.		
Weathered Wayfarer	{W}		Creature	Human,Nomad,Cleric	{W}, {T}: Search your library for a land card, reveal it, and put it into your hand. Then shuffle your library. Activate this ability only if an opponent controls more lands than you.	1	1
Weird Harvest	{X}{G}{G}		Sorcery		Each player may search his or her library for up to X creature cards, reveal those cards, and put them into his or her hand. Then each player who searched his or her library this way shuffles it.		
Wellwisher	{1}{G}		Creature	Elf	{T}: You gain 1 life for each Elf on the battlefield.	1	1
Wheel and Deal	{3}{U}		Instant		Any number of target opponents each discards his or her hand and draws seven cards.|Draw a card.		
Whipcorder	{W}{W}		Creature	Human,Soldier,Rebel	{W}, {T}: Tap target creature.|Morph {W} (You may cast this face down as a 2/2 creature for {3}. Turn it face up any time for its morph cost.)	2	2
Windswept Heath			Land		{T}, Pay 1 life, Sacrifice Windswept Heath: Search your library for a Forest or Plains card and put it onto the battlefield. Then shuffle your library.		
Wirewood Elf	{1}{G}		Creature	Elf,Druid	{T}: Add {G} to your mana pool.	1	2
Wirewood Herald	{1}{G}		Creature	Elf	When Wirewood Herald dies, you may search your library for an Elf card, reveal that card, put it into your hand, then shuffle your library.	1	1
Wirewood Lodge			Land		{T}: Add {1} to your mana pool.|{G}, {T}: Untap target Elf.		
Wirewood Pride	{G}		Instant		Target creature gets +X/+X until end of turn, where X is the number of Elves on the battlefield.		
Wirewood Savage	{2}{G}		Creature	Elf	Whenever a Beast enters the battlefield, you may draw a card.	2	2
Withering Hex	{B}		Enchantment	Aura	Enchant creature|Whenever a player cycles a card, put a plague counter on Withering Hex.|Enchanted creature gets -1/-1 for each plague counter on Withering Hex.		
Wooded Foothills			Land		{T}, Pay 1 life, Sacrifice Wooded Foothills: Search your library for a Mountain or Forest card and put it onto the battlefield. Then shuffle your library.		
Words of War	{2}{R}		Enchantment		{1}: The next time you would draw a card this turn, Words of War deals 2 damage to target creature or player instead.		
Words of Waste	{2}{B}		Enchantment		{1}: The next time you would draw a card this turn, each opponent discards a card instead.		
Words of Wilding	{2}{G}		Enchantment		{1}: The next time you would draw a card this turn, put a 2/2 green Bear creature token onto the battlefield instead.		
Words of Wind	{2}{U}		Enchantment		{1}: The next time you would draw a card this turn, each player returns a permanent he or she controls to its owner's hand instead.		
Words of Worship	{2}{W}		Enchantment		{1}: The next time you would draw a card this turn, you gain 5 life instead.		
Wretched Anurid	{1}{B}		Creature	Zombie,Frog,Beast	Whenever another creature enters the battlefield, you lose 1 life.	3	3
