Name	ManaCost	SuperType	Types	SubTypes	Text	Power	Toughness
Ith, High Arcanist	{5}{W}{U}	Legendary	Creature	Human,Wizard	Vigilance|{T}: Untap target attacking creature. Prevent all combat damage that would be dealt to and dealt by that creature this turn.|Suspend 4-{W}{U} (Rather than cast this card from your hand, you may pay {W}{U} and exile it with four time counters on it. At the beginning of your upkeep, remove a time counter. When the last is removed, cast it without paying its mana cost. It has haste.)	3	5
Ivory Giant	{5}{W}{W}		Creature	Giant	When Ivory Giant enters the battlefield, tap all nonwhite creatures.|Suspend 5-{W} (Rather than cast this card from your hand, you may pay {W} and exile it with five time counters on it. At the beginning of your upkeep, remove a time counter. When the last is removed, cast it without paying its mana cost. It has haste.)	3	4
Ixidron	{3}{U}{U}		Creature	Illusion	As Ixidron enters the battlefield, turn all other nontoken creatures face down. (They're 2/2 creatures.)|Ixidron's power and toughness are each equal to the number of face-down creatures on the battlefield.	*	*
Jaya Ballard, Task Mage	{1}{R}{R}	Legendary	Creature	Human,Spellshaper	{R}, {T}, Discard a card: Destroy target blue permanent.|{1}{R}, {T}, Discard a card: Jaya Ballard, Task Mage deals 3 damage to target creature or player. A creature dealt damage this way can't be regenerated this turn.|{5}{R}{R}, {T}, Discard a card: Jaya Ballard deals 6 damage to each creature and each player.	2	2
Jedit's Dragoons	{5}{W}		Creature	Cat,Soldier	Vigilance|When Jedit's Dragoons enters the battlefield, you gain 4 life.	2	5
Jhoira's Timebug	{2}		Artifact,Creature	Insect	{T}: Choose target permanent you control or suspended card you own. If that permanent or card has a time counter on it, you may remove a time counter from it or put another time counter on it.	1	2
Kaervek the Merciless	{5}{B}{R}	Legendary	Creature	Human,Shaman	Whenever an opponent casts a spell, Kaervek the Merciless deals damage to target creature or player equal to that spell's converted mana cost.	5	4
Keldon Halberdier	{4}{R}		Creature	Human,Warrior	First strike|Suspend 4-{R} (Rather than cast this card from your hand, you may pay {R} and exile it with four time counters on it. At the beginning of your upkeep, remove a time counter. When the last is removed, cast it without paying its mana cost. It has haste.)	4	1
Kher Keep		Legendary	Land		{T}: Add {1} to your mana pool.|{1}{R}, {T}: Put a 0/1 red Kobold creature token named Kobolds of Kher Keep onto the battlefield.		
Knight of the Holy Nimbus	{W}{W}		Creature	Human,Rebel,Knight	Flanking (Whenever a creature without flanking blocks this creature, the blocking creature gets -1/-1 until end of turn.)|If Knight of the Holy Nimbus would be destroyed, regenerate it.|{2}: Knight of the Holy Nimbus can't be regenerated this turn. Only any opponent may activate this ability.	2	2
Krosan Grip	{2}{G}		Instant		Split second (As long as this spell is on the stack, players can't cast spells or activate abilities that aren't mana abilities.)|Destroy target artifact or enchantment.		
Liege of the Pit	{5}{B}{B}{B}		Creature	Demon	Flying, trample|At the beginning of your upkeep, sacrifice a creature other than Liege of the Pit. If you can't, Liege of the Pit deals 7 damage to you.|Morph {B}{B}{B}{B} (You may cast this face down as a 2/2 creature for {3}. Turn it face up any time for its morph cost.)	7	7
Lightning Axe	{R}		Instant		As an additional cost to cast Lightning Axe, discard a card or pay {5}.|Lightning Axe deals 5 damage to target creature.		
Lim-Dûl the Necromancer	{5}{B}{B}	Legendary	Creature	Human,Wizard	Whenever a creature an opponent controls dies, you may pay {1}{B}. If you do, return that card to the battlefield under your control. If it's a creature, it's a Zombie in addition to its other creature types.|{1}{B}: Regenerate target Zombie.	4	4
Living End			Sorcery		Suspend 3-{2}{B}{B} (Rather than cast this card from your hand, pay {2}{B}{B} and exile it with three time counters on it. At the beginning of your upkeep, remove a time counter. When the last is removed, cast it without paying its mana cost.)|Each player exiles all creature cards from his or her graveyard, then sacrifices all creatures he or she controls, then puts all cards he or she exiled this way onto the battlefield.		
Locket of Yesterdays	{1}		Artifact		Spells you cast cost {1} less to cast for each card with the same name as that spell in your graveyard.		
Looter il-Kor	{1}{U}		Creature	Kor,Rogue	Shadow (This creature can block or be blocked by only creatures with shadow.)|Whenever Looter il-Kor deals damage to an opponent, draw a card, then discard a card.	1	1
Lotus Bloom			Artifact		Suspend 3-{0} (Rather than cast this card from your hand, pay {0} and exile it with three time counters on it. At the beginning of your upkeep, remove a time counter. When the last is removed, cast it without paying its mana cost.)|{T}, Sacrifice Lotus Bloom: Add three mana of any one color to your mana pool.		
Magus of the Candelabra	{G}		Creature	Human,Wizard	{X}, {T}: Untap X target lands.	1	2
Magus of the Disk	{2}{W}{W}		Creature	Human,Wizard	Magus of the Disk enters the battlefield tapped.|{1}, {T}: Destroy all artifacts, creatures, and enchantments.	2	4
Magus of the Jar	{3}{U}{U}		Creature	Human,Wizard	{T}, Sacrifice Magus of the Jar: Each player exiles all cards from his or her hand face down and draws seven cards. At the beginning of the next end step, each player discards his or her hand and returns to his or her hand each card he or she exiled this way.	3	3
Magus of the Mirror	{4}{B}{B}		Creature	Human,Wizard	{T}, Sacrifice Magus of the Mirror: Exchange life totals with target opponent. Activate this ability only during your upkeep.	4	2
Magus of the Scroll	{R}		Creature	Human,Wizard	{3}, {T}: Name a card. Reveal a card at random from your hand. If it's the named card, Magus of the Scroll deals 2 damage to target creature or player.	1	1
Mana Skimmer	{3}{B}		Creature	Leech	Flying|Whenever Mana Skimmer deals damage to a player, tap target land that player controls. That land doesn't untap during its controller's next untap step.	2	2
Mangara of Corondor	{1}{W}{W}	Legendary	Creature	Human,Wizard	{T}: Exile Mangara of Corondor and target permanent.	1	1
Might of Old Krosa	{G}		Instant		Target creature gets +2/+2 until end of turn. If you cast this spell during your main phase, that creature gets +4/+4 until end of turn instead.		
Might Sliver	{4}{G}		Creature	Sliver	All Sliver creatures get +2/+2.	2	2
Mindlash Sliver	{B}		Creature	Sliver	All Slivers have '{1}, Sacrifice this permanent: Each player discards a card.'	1	1
Mindstab	{5}{B}		Sorcery		Target player discards three cards.|Suspend 4-{B} (Rather than cast this card from your hand, you may pay {B} and exile it with four time counters on it. At the beginning of your upkeep, remove a time counter. When the last is removed, cast it without paying its mana cost.)		
Mishra, Artificer Prodigy	{1}{U}{B}{R}	Legendary	Creature	Human,Artificer	Whenever you cast an artifact spell, you may search your graveyard, hand, and/or library for a card with the same name as that spell and put it onto the battlefield. If you search your library this way, shuffle it.	4	4
Mogg War Marshal	{1}{R}		Creature	Goblin,Warrior	Echo {1}{R} (At the beginning of your upkeep, if this came under your control since the beginning of your last upkeep, sacrifice it unless you pay its echo cost.)|When Mogg War Marshal enters the battlefield or dies, put a 1/1 red Goblin creature token onto the battlefield.	1	1
Molder	{X}{G}		Instant		Destroy target artifact or enchantment with converted mana cost X. It can't be regenerated. You gain X life.		
Molten Slagheap			Land		{T}: Add {1} to your mana pool.|{1}, {T}: Put a storage counter on Molten Slagheap.|{1}, Remove X storage counters from Molten Slagheap: Add X mana in any combination of {B} and/or {R} to your mana pool.		
Momentary Blink	{1}{W}		Instant		Exile target creature you control, then return it to the battlefield under its owner's control.|Flashback {3}{U} (You may cast this card from your graveyard for its flashback cost. Then exile it.)		
Moonlace	{U}		Instant		Target spell or permanent becomes colorless.		
Mountain		Basic	Land	Mountain	R		
Mwonvuli Acid-Moss	{2}{G}{G}		Sorcery		Destroy target land. Search your library for a Forest card and put that card onto the battlefield tapped. Then shuffle your library.		
Mystical Teachings	{3}{U}		Instant		Search your library for an instant card or a card with flash, reveal it, and put it into your hand. Then shuffle your library.|Flashback {5}{B} (You may cast this card from your graveyard for its flashback cost. Then exile it.)		
Nantuko Shaman	{2}{G}		Creature	Insect,Shaman	When Nantuko Shaman enters the battlefield, if you control no tapped lands, draw a card.|Suspend 1-{2}{G}{G} (Rather than cast this card from your hand, you may pay {2}{G}{G} and exile it with a time counter on it. At the beginning of your upkeep, remove a time counter. When the last is removed, cast it without paying its mana cost. It has haste.)	3	2
Nether Traitor	{B}{B}		Creature	Spirit	Haste|Shadow (This creature can block or be blocked by only creatures with shadow.)|Whenever another creature is put into your graveyard from the battlefield, you may pay {B}. If you do, return Nether Traitor from your graveyard to the battlefield.	1	1
Nightshade Assassin	{2}{B}{B}		Creature	Human,Assassin	First strike|When Nightshade Assassin enters the battlefield, you may reveal X black cards in your hand. If you do, target creature gets -X/-X until end of turn.|Madness {1}{B} (If you discard this card, you may cast it for its madness cost instead of putting it into your graveyard.)	2	1
Norin the Wary	{R}	Legendary	Creature	Human,Warrior	When a player casts a spell or a creature attacks, exile Norin the Wary. Return it to the battlefield under its owner's control at the beginning of the next end step.	2	1
Opal Guardian	{W}{W}{W}		Enchantment		When an opponent casts a creature spell, if Opal Guardian is an enchantment, Opal Guardian becomes a 3/4 Gargoyle creature with flying and protection from red.		
Opaline Sliver	{1}{W}{U}		Creature	Sliver	All Slivers have 'Whenever this permanent becomes the target of a spell an opponent controls, you may draw a card.'	2	2
Ophidian Eye	{2}{U}		Enchantment	Aura	Flash (You may cast this spell any time you could cast an instant.)|Enchant creature|Whenever enchanted creature deals damage to an opponent, you may draw a card.		
Orcish Cannonade	{1}{R}{R}		Instant		Orcish Cannonade deals 2 damage to target creature or player and 3 damage to you.|Draw a card.		
Outrider en-Kor	{2}{W}		Creature	Kor,Rebel,Knight	Flanking (Whenever a creature without flanking blocks this creature, the blocking creature gets -1/-1 until end of turn.)|{0}: The next 1 damage that would be dealt to Outrider en-Kor this turn is dealt to target creature you control instead.	2	2
Paradise Plume	{4}		Artifact		As Paradise Plume enters the battlefield, choose a color.|Whenever a player casts a spell of the chosen color, you may gain 1 life.|{T}: Add one mana of the chosen color to your mana pool.		
Paradox Haze	{2}{U}		Enchantment	Aura	Enchant player|At the beginning of enchanted player's first upkeep each turn, that player gets an additional upkeep step after this step.		
Pardic Dragon	{4}{R}{R}		Creature	Dragon	Flying|{R}: Pardic Dragon gets +1/+0 until end of turn.|Suspend 2-{R}{R}|Whenever an opponent casts a spell, if Pardic Dragon is suspended, that player may put a time counter on Pardic Dragon.	4	4
Pendelhaven Elder	{1}{G}		Creature	Elf,Shaman	{T}: Each 1/1 creature you control gets +1/+2 until end of turn.	1	1
Pentarch Paladin	{2}{W}{W}{W}		Creature	Human,Knight	Flanking (Whenever a creature without flanking blocks this creature, the blocking creature gets -1/-1 until end of turn.)|As Pentarch Paladin enters the battlefield, choose a color.|{W}{W}, {T}: Destroy target permanent of the chosen color.	3	3
Pentarch Ward	{2}{W}		Enchantment	Aura	Enchant creature|As Pentarch Ward enters the battlefield, choose a color.|When Pentarch Ward enters the battlefield, draw a card.|Enchanted creature has protection from the chosen color. This effect doesn't remove Pentarch Ward.		
Penumbra Spider	{2}{G}{G}		Creature	Spider	Reach|When Penumbra Spider dies, put a 2/4 black Spider creature token with reach onto the battlefield.	2	4
Phantom Wurm	{4}{G}{G}		Creature	Wurm,Spirit	Phantom Wurm enters the battlefield with four +1/+1 counters on it.|If damage would be dealt to Phantom Wurm, prevent that damage. Remove a +1/+1 counter from Phantom Wurm.	2	0
Phthisis	{3}{B}{B}{B}{B}		Sorcery		Destroy target creature. Its controller loses life equal to its power plus its toughness.|Suspend 5-{1}{B} (Rather than cast this card from your hand, you may pay {1}{B} and exile it with five time counters on it. At the beginning of your upkeep, remove a time counter. When the last is removed, cast it without paying its mana cost.)		
Phyrexian Totem	{3}		Artifact		{T}: Add {B} to your mana pool.|{2}{B}: Phyrexian Totem becomes a 5/5 black Horror artifact creature with trample until end of turn.|Whenever Phyrexian Totem is dealt damage, if it's a creature, sacrifice that many permanents.		
Pit Keeper	{1}{B}		Creature	Human,Wizard	When Pit Keeper enters the battlefield, if you have four or more creature cards in your graveyard, you may return target creature card from your graveyard to your hand.	2	1
Plague Sliver	{2}{B}{B}		Creature	Sliver	All Slivers have 'At the beginning of your upkeep, this permanent deals 1 damage to you.'	5	5
Plains		Basic	Land	Plains	W		
Plated Pegasus	{2}{W}		Creature	Pegasus	Flash (You may cast this spell any time you could cast an instant.)|Flying|If a spell would deal damage to a creature or player, prevent 1 damage that spell would deal to that creature or player.	1	2
Plunder	{4}{R}		Sorcery		Destroy target artifact or land.|Suspend 4-{1}{R} (Rather than cast this card from your hand, you may pay {1}{R} and exile it with four time counters on it. At the beginning of your upkeep, remove a time counter. When the last is removed, cast it without paying its mana cost.)		
Premature Burial	{1}{B}		Sorcery		Destroy target nonblack creature that entered the battlefield since your last turn ended.		
Primal Forcemage	{2}{G}		Creature	Elf,Shaman	Whenever another creature enters the battlefield under your control, that creature gets +3/+3 until end of turn.	2	2
Prismatic Lens	{2}		Artifact		{T}: Add {1} to your mana pool.|{1}, {T}: Add one mana of any color to your mana pool.		
Psionic Sliver	{4}{U}		Creature	Sliver	All Sliver creatures have '{T}: This creature deals 2 damage to target creature or player and 3 damage to itself.'	2	2
Psychotic Episode	{1}{B}{B}		Sorcery		Target player reveals his or her hand and the top card of his or her library. You choose a card revealed this way. That player puts the chosen card on the bottom of his or her library.|Madness {1}{B} (If you discard this card, you may cast it for its madness cost instead of putting it into your graveyard.)		
Pull from Eternity	{W}		Instant		Put target face-up exiled card into its owner's graveyard.		
Pulmonic Sliver	{3}{W}{W}		Creature	Sliver	All Sliver creatures have flying.|All Slivers have 'If this permanent would be put into a graveyard, you may put it on top of its owner's library instead.'	3	3
Quilled Sliver	{1}{W}		Creature	Sliver	All Slivers have '{T}: This permanent deals 1 damage to target attacking or blocking creature.'	1	1
Reiterate	{1}{R}{R}		Instant		Buyback {3} (You may pay an additional {3} as you cast this spell. If you do, put this card into your hand as it resolves.)|Copy target instant or sorcery spell. You may choose new targets for the copy.		
Restore Balance			Sorcery		Suspend 6-{W} (Rather than cast this card from your hand, pay {W} and exile it with six time counters on it. At the beginning of your upkeep, remove a time counter. When the last is removed, cast it without paying its mana cost.)|Each player chooses a number of lands he or she controls equal to the number of lands controlled by the player who controls the fewest, then sacrifices the rest. Players sacrifice creatures and discard cards the same way.		
Return to Dust	{2}{W}{W}		Instant		Exile target artifact or enchantment. If you cast this spell during your main phase, you may exile up to one other target artifact or enchantment.		
Rift Bolt	{2}{R}		Sorcery		Rift Bolt deals 3 damage to target creature or player.|Suspend 1-{R} (Rather than cast this card from your hand, you may pay {R} and exile it with a time counter on it. At the beginning of your upkeep, remove a time counter. When the last is removed, cast it without paying its mana cost.)		
Riftwing Cloudskate	{3}{U}{U}		Creature	Illusion	Flying|When Riftwing Cloudskate enters the battlefield, return target permanent to its owner's hand.|Suspend 3-{1}{U} (Rather than cast this card from your hand, you may pay {1}{U} and exile it with three time counters on it. At the beginning of your upkeep, remove a time counter. When the last is removed, cast it without paying its mana cost. It has haste.)	2	2
Saffi Eriksdotter	{G}{W}	Legendary	Creature	Human,Scout	Sacrifice Saffi Eriksdotter: When target creature is put into your graveyard from the battlefield this turn, return that card to the battlefield.	2	2
Sage of Epityr	{U}		Creature	Human,Wizard	When Sage of Epityr enters the battlefield, look at the top four cards of your library, then put them back in any order.	1	1
Saltcrusted Steppe			Land		{T}: Add {1} to your mana pool.|{1}, {T}: Put a storage counter on Saltcrusted Steppe.|{1}, Remove X storage counters from Saltcrusted Steppe: Add X mana in any combination of {G} and/or {W} to your mana pool.		
Sangrophage	{B}{B}		Creature	Zombie	At the beginning of your upkeep, tap Sangrophage unless you pay 2 life.	3	3
Sarpadian Empires, Vol. VII	{3}		Artifact		As Sarpadian Empires, Vol. VII enters the battlefield, choose white Citizen, blue Camarid, black Thrull, red Goblin, or green Saproling.|{3}, {T}: Put a 1/1 creature token of the chosen color and type onto the battlefield.		
Savage Thallid	{3}{G}{G}		Creature	Fungus	At the beginning of your upkeep, put a spore counter on Savage Thallid.|Remove three spore counters from Savage Thallid: Put a 1/1 green Saproling creature token onto the battlefield.|Sacrifice a Saproling: Regenerate target Fungus.	5	2
Scarwood Treefolk	{3}{G}		Creature	Treefolk	Scarwood Treefolk enters the battlefield tapped.	3	5
Scion of the Ur-Dragon	{W}{U}{B}{R}{G}	Legendary	Creature	Dragon,Avatar	Flying|{2}: Search your library for a Dragon permanent card and put it into your graveyard. If you do, Scion of the Ur-Dragon becomes a copy of that card until end of turn. Then shuffle your library.	4	4
Screeching Sliver	{U}		Creature	Sliver	All Slivers have '{T}: Target player puts the top card of his or her library into his or her graveyard.'	1	1
Scryb Ranger	{1}{G}		Creature	Faerie	Flash (You may cast this spell any time you could cast an instant.)|Flying, protection from blue|Return a Forest you control to its owner's hand: Untap target creature. Activate this ability only once each turn.	1	1
Search for Tomorrow	{2}{G}		Sorcery		Search your library for a basic land card and put it onto the battlefield. Then shuffle your library.|Suspend 2-{G} (Rather than cast this card from your hand, you may pay {G} and exile it with two time counters on it. At the beginning of your upkeep, remove a time counter. When the last is removed, cast it without paying its mana cost.)		
Sedge Sliver	{2}{R}		Creature	Sliver	All Sliver creatures have 'This creature gets +1/+1 as long as you control a Swamp.'|All Slivers have '{B}: Regenerate this permanent.'	2	2
Sengir Nosferatu	{3}{B}{B}		Creature	Vampire	Flying|{1}{B}, Exile Sengir Nosferatu: Put a 1/2 black Bat creature token with flying onto the battlefield. It has '{1}{B}, Sacrifice this creature: Return an exiled card named Sengir Nosferatu to the battlefield under its owner's control.'	4	4
Serra Avenger	{W}{W}		Creature	Angel	You can't cast Serra Avenger during your first, second, or third turns of the game.|Flying|Vigilance (Attacking doesn't cause this creature to tap.)	3	3
Shadow Sliver	{2}{U}		Creature	Sliver	All Sliver creatures have shadow. (They can block or be blocked by only creatures with shadow.)	1	1
Sidewinder Sliver	{W}		Creature	Sliver	All Sliver creatures have flanking. (Whenever a creature without flanking blocks a Sliver, the blocking creature gets -1/-1 until end of turn.)	1	1
Skittering Monstrosity	{3}{B}{B}		Creature	Horror	When you cast a creature spell, sacrifice Skittering Monstrosity.	5	5
Skulking Knight	{2}{B}		Creature	Zombie,Knight	Flanking (Whenever a creature without flanking blocks this creature, the blocking creature gets -1/-1 until end of turn.)|When Skulking Knight becomes the target of a spell or ability, sacrifice it.	3	3
Slipstream Serpent	{7}{U}		Creature	Serpent	Slipstream Serpent can't attack unless defending player controls an Island.|When you control no Islands, sacrifice Slipstream Serpent.|Morph {5}{U} (You may cast this face down as a 2/2 creature for {3}. Turn it face up any time for its morph cost.)	6	6
Smallpox	{B}{B}		Sorcery		Each player loses 1 life, discards a card, sacrifices a creature, then sacrifices a land.		
Snapback	{1}{U}		Instant		You may exile a blue card from your hand rather than pay Snapback's mana cost.|Return target creature to its owner's hand.		
Spectral Force	{3}{G}{G}		Creature	Elemental,Spirit	Trample|Whenever Spectral Force attacks, if defending player controls no black permanents, it doesn't untap during your next untap step.	8	8
Spell Burst	{X}{U}		Instant		Buyback {3} (You may pay an additional {3} as you cast this spell. If you do, put this card into your hand as it resolves.)|Counter target spell with converted mana cost X.		
Spike Tiller	{3}{G}{G}		Creature	Spike	Spike Tiller enters the battlefield with three +1/+1 counters on it.|{2}, Remove a +1/+1 counter from Spike Tiller: Put a +1/+1 counter on target creature.|{2}, Remove a +1/+1 counter from Spike Tiller: Target land becomes a 2/2 creature that's still a land. Put a +1/+1 counter on it.	0	0
Spiketail Drakeling	{1}{U}{U}		Creature	Drake	Flying|Sacrifice Spiketail Drakeling: Counter target spell unless its controller pays {2}.	2	2
Spinneret Sliver	{1}{G}		Creature	Sliver	All Sliver creatures have reach. (They can block creatures with flying.)	2	2
Spirit Loop	{1}{W}		Enchantment	Aura	Enchant creature you control|Whenever enchanted creature deals damage, you gain that much life.|When Spirit Loop is put into a graveyard from the battlefield, return Spirit Loop to its owner's hand.		
Sporesower Thallid	{2}{G}{G}		Creature	Fungus	At the beginning of your upkeep, put a spore counter on each Fungus you control.|Remove three spore counters from Sporesower Thallid: Put a 1/1 green Saproling creature token onto the battlefield.	4	4
Sprite Noble	{1}{U}{U}		Creature	Faerie	Flying|Other creatures you control with flying get +0/+1.|{T}: Other creatures you control with flying get +1/+0 until end of turn.	2	2
Sprout	{G}		Instant		Put a 1/1 green Saproling creature token onto the battlefield.		
Squall Line	{X}{G}{G}		Instant		Squall Line deals X damage to each creature with flying and each player.		
Stonebrow, Krosan Hero	{3}{R}{G}	Legendary	Creature	Centaur,Warrior	Trample|Whenever a creature you control with trample attacks, it gets +2/+2 until end of turn.	4	4
Stonewood Invocation	{3}{G}		Instant		Split second (As long as this spell is on the stack, players can't cast spells or activate abilities that aren't mana abilities.)|Target creature gets +5/+5 and gains shroud until end of turn. (It can't be the target of spells or abilities.)		
Stormcloud Djinn	{4}{U}		Creature	Djinn	Flying|Stormcloud Djinn can block only creatures with flying.|{R}{R}: Stormcloud Djinn gets +2/+0 until end of turn and deals 1 damage to you.	3	3
Strangling Soot	{2}{B}		Instant		Destroy target creature with toughness 3 or less.|Flashback {5}{R} (You may cast this card from your graveyard for its flashback cost. Then exile it.)		
Strength in Numbers	{1}{G}		Instant		Until end of turn, target creature gains trample and gets +X/+X, where X is the number of attacking creatures.		
Stronghold Overseer	{3}{B}{B}{B}		Creature	Demon	Flying|Shadow (This creature can block or be blocked by only creatures with shadow.)|{B}{B}: Creatures with shadow get +1/+0 until end of turn and creatures without shadow get -1/-0 until end of turn.	5	5
Stuffy Doll	{5}		Artifact,Creature	Construct	Indestructible|As Stuffy Doll enters the battlefield, choose a player.|Whenever Stuffy Doll is dealt damage, it deals that much damage to the chosen player.|{T}: Stuffy Doll deals 1 damage to itself.	0	1
Subterranean Shambler	{3}{R}		Creature	Elemental	Echo {3}{R} (At the beginning of your upkeep, if this came under your control since the beginning of your last upkeep, sacrifice it unless you pay its echo cost.)|When Subterranean Shambler enters the battlefield or leaves the battlefield, it deals 1 damage to each creature without flying.	2	3
Sudden Death	{1}{B}{B}		Instant		Split second (As long as this spell is on the stack, players can't cast spells or activate abilities that aren't mana abilities.)|Target creature gets -4/-4 until end of turn.		
Sudden Shock	{1}{R}		Instant		Split second (As long as this spell is on the stack, players can't cast spells or activate abilities that aren't mana abilities.)|Sudden Shock deals 2 damage to target creature or player.		
Sudden Spoiling	{1}{B}{B}		Instant		Split second (As long as this spell is on the stack, players can't cast spells or activate abilities that aren't mana abilities.)|Creatures target player controls become 0/2 and lose all abilities until end of turn.		
