Name	ManaCost	SuperType	Types	SubTypes	Text	Power	Toughness
Sulfurous Blast	{2}{R}{R}		Instant		Sulfurous Blast deals 2 damage to each creature and each player. If you cast this spell during your main phase, Sulfurous Blast deals 3 damage to each creature and each player instead.		
Swamp		Basic	Land	Swamp	B		
Swarmyard			Land		{T}: Add {1} to your mana pool.|{T}: Regenerate target Insect, Rat, Spider, or Squirrel.		
Tectonic Fiend	{4}{R}{R}		Creature	Elemental	Echo {4}{R}{R} (At the beginning of your upkeep, if this came under your control since the beginning of your last upkeep, sacrifice it unless you pay its echo cost.)|Tectonic Fiend attacks each turn if able.	7	7
Teferi, Mage of Zhalfir	{2}{U}{U}{U}	Legendary	Creature	Human,Wizard	Flash (You may cast this spell any time you could cast an instant.)|Creature cards you own that aren't on the battlefield have flash.|Each opponent can cast spells only any time he or she could cast a sorcery.	3	4
Telekinetic Sliver	{2}{U}{U}		Creature	Sliver	All Slivers have '{T}: Tap target permanent.'	2	2
Temporal Eddy	{2}{U}{U}		Sorcery		Put target creature or land on top of its owner's library.		
Temporal Isolation	{1}{W}		Enchantment	Aura	Flash (You may cast this spell any time you could cast an instant.)|Enchant creature|Enchanted creature has shadow. (It can block or be blocked by only creatures with shadow.)|Prevent all damage that would be dealt by enchanted creature.		
Tendrils of Corruption	{3}{B}		Instant		Tendrils of Corruption deals X damage to target creature and you gain X life, where X is the number of Swamps you control.		
Terramorphic Expanse			Land		{T}, Sacrifice Terramorphic Expanse: Search your library for a basic land card and put it onto the battlefield tapped. Then shuffle your library.		
Thallid Germinator	{2}{G}		Creature	Fungus	At the beginning of your upkeep, put a spore counter on Thallid Germinator.|Remove three spore counters from Thallid Germinator: Put a 1/1 green Saproling creature token onto the battlefield.|Sacrifice a Saproling: Target creature gets +1/+1 until end of turn.	2	2
Thallid Shell-Dweller	{1}{G}		Creature	Fungus	Defender|At the beginning of your upkeep, put a spore counter on Thallid Shell-Dweller.|Remove three spore counters from Thallid Shell-Dweller: Put a 1/1 green Saproling creature token onto the battlefield.	0	5
Thelon of Havenwood	{G}{G}	Legendary	Creature	Elf,Druid	Each Fungus creature gets +1/+1 for each spore counter on it.|{B}{G}, Exile a Fungus card from a graveyard: Put a spore counter on each Fungus on the battlefield.	2	2
Thelonite Hermit	{3}{G}		Creature	Elf,Shaman	Saproling creatures get +1/+1.|Morph {3}{G}{G} (You may cast this face down as a 2/2 creature for {3}. Turn it face up any time for its morph cost.)|When Thelonite Hermit is turned face up, put four 1/1 green Saproling creature tokens onto the battlefield.	1	1
Thick-Skinned Goblin	{1}{R}		Creature	Goblin,Shaman	You may pay {0} rather than pay the echo cost for permanents you control.|{R}: Thick-Skinned Goblin gains protection from red until end of turn.	2	1
Think Twice	{1}{U}		Instant		Draw a card.|Flashback {2}{U} (You may cast this card from your graveyard for its flashback cost. Then exile it.)		
Thrill of the Hunt	{G}		Instant		Target creature gets +1/+2 until end of turn.|Flashback {W} (You may cast this card from your graveyard for its flashback cost. Then exile it.)		
Thunder Totem	{3}		Artifact		{T}: Add {W} to your mana pool.|{1}{W}{W}: Thunder Totem becomes a 2/2 white Spirit artifact creature with flying and first strike until end of turn.		
Tivadar of Thorn	{1}{W}{W}	Legendary	Creature	Human,Knight	First strike, protection from red|When Tivadar of Thorn enters the battlefield, destroy target Goblin.	2	2
Tolarian Sentinel	{3}{U}		Creature	Human,Spellshaper	Flying|{U}, {T}, Discard a card: Return target permanent you control to its owner's hand.	1	3
Traitor's Clutch	{4}{B}		Instant		Target creature gets +1/+0, becomes black, and gains shadow until end of turn. (It can block or be blocked by only creatures with shadow.)|Flashback {1}{B} (You may cast this card from your graveyard for its flashback cost. Then exile it.)		
Trespasser il-Vec	{2}{B}		Creature	Human,Rogue	Discard a card: Trespasser il-Vec gains shadow until end of turn. (It can block or be blocked by only creatures with shadow.)	3	1
Trickbind	{1}{U}		Instant		Split second (As long as this spell is on the stack, players can't cast spells or activate abilities that aren't mana abilities.)|Counter target activated or triggered ability. If a permanent's ability is countered this way, activated abilities of that permanent can't be activated this turn. (Mana abilities can't be targeted.)		
Triskelavus	{7}		Artifact,Creature	Construct	Flying|Triskelavus enters the battlefield with three +1/+1 counters on it.|{1}, Remove a +1/+1 counter from Triskelavus: Put a 1/1 colorless Triskelavite artifact creature token with flying onto the battlefield. It has 'Sacrifice this creature: This creature deals 1 damage to target creature or player.'	1	1
Tromp the Domains	{5}{G}		Sorcery		Domain - Until end of turn, creatures you control gain trample and get +1/+1 for each basic land type among lands you control.		
Truth or Tale	{1}{U}		Instant		Reveal the top five cards of your library and separate them into two piles. An opponent chooses one of those piles. Put a card from the chosen pile into your hand, then put all other cards revealed this way on the bottom of your library in any order.		
Two-Headed Sliver	{1}{R}		Creature	Sliver	All Sliver creatures have 'This creature can't be blocked except by two or more creatures.'	1	1
Undying Rage	{2}{R}		Enchantment	Aura	Enchant creature|Enchanted creature gets +2/+2 and can't block.|When Undying Rage is put into a graveyard from the battlefield, return Undying Rage to its owner's hand.		
Unyaro Bees	{G}{G}{G}		Creature	Insect	Flying|{G}: Unyaro Bees gets +1/+1 until end of turn.|{3}{G}, Sacrifice Unyaro Bees: Unyaro Bees deals 2 damage to target creature or player.	0	1
Urborg Syphon-Mage	{2}{B}		Creature	Human,Spellshaper	{2}{B}, {T}, Discard a card: Each other player loses 2 life. You gain life equal to the life lost this way.	2	2
Urza's Factory			Land	Urza’s	{T}: Add {1} to your mana pool.|{7}, {T}: Put a 2/2 colorless Assembly-Worker artifact creature token onto the battlefield.		
Vampiric Sliver	{3}{B}		Creature	Sliver	All Sliver creatures have 'Whenever a creature dealt damage by this creature this turn dies, put a +1/+1 counter on this creature.'	3	3
Venser's Sliver	{5}		Artifact,Creature	Sliver		3	3
Verdant Embrace	{3}{G}{G}		Enchantment	Aura	Enchant creature|Enchanted creature gets +3/+3 and has 'At the beginning of each upkeep, put a 1/1 green Saproling creature token onto the battlefield.'		
Vesuva			Land		You may have Vesuva enter the battlefield tapped as a copy of any land on the battlefield.		
Vesuvan Shapeshifter	{3}{U}{U}		Creature	Shapeshifter	As Vesuvan Shapeshifter enters the battlefield or is turned face up, you may choose another creature on the battlefield. If you do, until Vesuvan Shapeshifter is turned face down, it becomes a copy of that creature and gains 'At the beginning of your upkeep, you may turn this creature face down.'|Morph {1}{U} (You may cast this face down as a 2/2 creature for {3}. Turn it face up any time for its morph cost.)	0	0
Viashino Bladescout	{1}{R}{R}		Creature	Viashino,Scout	Flash (You may cast this spell any time you could cast an instant.)|When Viashino Bladescout enters the battlefield, target creature gains first strike until end of turn.	2	1
Viscerid Deepwalker	{4}{U}		Creature	Homarid,Warrior	{U}: Viscerid Deepwalker gets +1/+0 until end of turn.|Suspend 4-{U} (Rather than cast this card from your hand, you may pay {U} and exile it with four time counters on it. At the beginning of your upkeep, remove a time counter. When the last is removed, cast it without paying its mana cost. It has haste.)	2	3
Viscid Lemures	{4}{B}		Creature	Spirit	{0}: Viscid Lemures gets -1/-0 and gains swampwalk until end of turn.	4	3
Voidmage Husher	{3}{U}		Creature	Human,Wizard	Flash (You may cast this spell any time you could cast an instant.)|When Voidmage Husher enters the battlefield, counter target activated ability. (Mana abilities can't be targeted.)|Whenever you cast a spell, you may return Voidmage Husher to its owner's hand.	2	2
Volcanic Awakening	{4}{R}{R}		Sorcery		Destroy target land.|Storm (When you cast this spell, copy it for each spell cast before it this turn. You may choose new targets for the copies.)		
Walk the Aeons	{4}{U}{U}		Sorcery		Buyback-Sacrifice three Islands. (You may sacrifice three Islands in addition to any other costs as you cast this spell. If you do, put this card into your hand as it resolves.)|Target player takes an extra turn after this one.		
Watcher Sliver	{3}{W}		Creature	Sliver	All Sliver creatures get +0/+2.	2	2
Weathered Bodyguards	{5}{W}		Creature	Human,Soldier	As long as Weathered Bodyguards is untapped, all combat damage that would be dealt to you by unblocked creatures is dealt to Weathered Bodyguards instead.|Morph {3}{W} (You may cast this face down as a 2/2 creature for {3}. Turn it face up any time for its morph cost.)	2	5
Weatherseed Totem	{3}		Artifact		{T}: Add {G} to your mana pool.|{2}{G}{G}{G}: Weatherseed Totem becomes a 5/3 green Treefolk artifact creature with trample until end of turn.|When Weatherseed Totem is put into a graveyard from the battlefield, if it was a creature, return this card to its owner's hand.		
Wheel of Fate			Sorcery		Suspend 4-{1}{R} (Rather than cast this card from your hand, pay {1}{R} and exile it with four time counters on it. At the beginning of your upkeep, remove a time counter. When the last is removed, cast it without paying its mana cost.)|Each player discards his or her hand, then draws seven cards.		
Wipe Away	{1}{U}{U}		Instant		Split second (As long as this spell is on the stack, players can't cast spells or activate abilities that aren't mana abilities.)|Return target permanent to its owner's hand.		
Word of Seizing	{3}{R}{R}		Instant		Split second (As long as this spell is on the stack, players can't cast spells or activate abilities that aren't mana abilities.)|Untap target permanent and gain control of it until end of turn. It gains haste until end of turn.		
Wormwood Dryad	{2}{G}		Creature	Dryad	{G}: Wormwood Dryad gains forestwalk until end of turn and deals 1 damage to you.|{B}: Wormwood Dryad gains swampwalk until end of turn and deals 1 damage to you.	3	1
Wurmcalling	{X}{G}		Sorcery		Buyback {2}{G} (You may pay an additional {2}{G} as you cast this spell. If you do, put this card into your hand as it resolves.)|Put an X/X green Wurm creature token onto the battlefield.		
Yavimaya Dryad	{1}{G}{G}		Creature	Dryad	Forestwalk|When Yavimaya Dryad enters the battlefield, you may search your library for a Forest card and put it onto the battlefield tapped under target player's control. If you do, shuffle your library.	2	1
Zealot il-Vec	{2}{W}		Creature	Human,Rebel	Shadow (This creature can block or be blocked by only creatures with shadow.)|Whenever Zealot il-Vec attacks and isn't blocked, you may have it deal 1 damage to target creature. If you do, prevent all combat damage Zealot il-Vec would deal this turn.	1	1
