Name	ManaCost	SuperType	Types	SubTypes	Text	Power	Toughness
Teroh's Vanguard	{3}{W}		Creature	Human,Nomad	Flash|Threshold - As long as seven or more cards are in your graveyard, Teroh's Vanguard has 'When Teroh's Vanguard enters the battlefield, creatures you control gain protection from black until end of turn.'	2	3
Transcendence	{3}{W}{W}{W}		Enchantment		You don't lose the game for having 0 or less life.||When you have 20 or more life, you lose the game.||Whenever you lose life, you gain 2 life for each 1 life you lost. (Damage dealt to you causes you to lose life.)		
Turbulent Dreams	{U}{U}		Sorcery		As an additional cost to cast Turbulent Dreams, discard X cards.|Return X target nonland permanents to their owners' hands.		
Unhinge	{2}{B}		Sorcery		Target player discards a card.|Draw a card.		
Vengeful Dreams	{W}{W}		Instant		As an additional cost to cast Vengeful Dreams, discard X cards.|Exile X target attacking creatures.		
Violent Eruption	{1}{R}{R}{R}		Instant		Violent Eruption deals 4 damage divided as you choose among any number of target creatures and/or players.|Madness {1}{R}{R} (If you discard this card, you may cast it for its madness cost instead of putting it into your graveyard.)		
Waste Away	{4}{B}		Instant		As an additional cost to cast Waste Away, discard a card.|Target creature gets -5/-5 until end of turn.		
Zombie Trailblazer	{B}{B}{B}		Creature	Zombie,Scout	Tap an untapped Zombie you control: Target land becomes a Swamp until end of turn.|Tap an untapped Zombie you control: Target creature gains swampwalk until end of turn.	2	2
