Name	ManaCost	SuperType	Types	SubTypes	Text	Power	Toughness
Touchstone	{2}		Artifact		{T}: Tap target artifact you don't control.		
Tranquil Grove	{1}{G}		Enchantment		{1}{G}{G}: Destroy all other enchantments.		
Uktabi Efreet	{2}{G}{G}		Creature	Efreet	Cumulative upkeep {G} (At the beginning of your upkeep, put an age counter on this permanent, then sacrifice it unless you pay its upkeep cost for each age counter on it.)	5	4
Urborg Justice	{B}{B}		Instant		Target opponent sacrifices a creature for each creature put into your graveyard from the battlefield this turn.		
Urborg Stalker	{3}{B}		Creature	Horror	At the beginning of each player's upkeep, if that player controls a nonblack, nonland permanent, Urborg Stalker deals 1 damage to that player.	2	4
Veteran Explorer	{G}		Creature	Human,Soldier,Scout	When Veteran Explorer dies, each player may search his or her library for up to two basic land cards and put them onto the battlefield. Then each player who searched his or her library this way shuffles it.	1	1
Vitalize	{G}		Instant		Untap all creatures you control.		
Vodalian Illusionist	{2}{U}		Creature	Merfolk,Wizard	{U}{U}, {T}: Target creature phases out. (While it's phased out, it's treated as though it doesn't exist. It phases in before its controller untaps during his or her next untap step.)	2	2
Volunteer Reserves	{1}{W}		Creature	Human,Soldier	Banding (Any creatures with banding, and up to one without, can attack in a band. Bands are blocked as a group. If any creatures with banding you control are blocking or being blocked by a creature, you divide that creature's combat damage, not its controller, among any of the creatures it's being blocked by or is blocking.)|Cumulative upkeep {1} (At the beginning of your upkeep, put an age counter on this permanent, then sacrifice it unless you pay its upkeep cost for each age counter on it.)	2	4
Wave of Terror	{2}{B}		Enchantment		Cumulative upkeep {1} (At the beginning of your upkeep, put an age counter on this permanent, then sacrifice it unless you pay its upkeep cost for each age counter on it.)|At the beginning of your draw step, destroy each creature with converted mana cost equal to the number of age counters on Wave of Terror. They can't be regenerated.		
Well of Knowledge	{3}		Artifact		{2}: Draw a card. Any player may activate this ability but only during his or her draw step.		
Winding Canyons			Land		{T}: Add {1} to your mana pool.|{2}, {T}: Until end of turn, you may play creature cards as though they had flash.		
Xanthic Statue	{8}		Artifact		{5}: Until end of turn, Xanthic Statue becomes an 8/8 Golem artifact creature with trample.		
Zombie Scavengers	{2}{B}		Creature	Zombie	Exile the top creature card of your graveyard: Regenerate Zombie Scavengers.	3	1
